Vendor Code,Master SKU,SKU,Channel,Channel SKU,Identifier,Status (Active / Inactive)
129-N.b.f Fashion,IM035273Mens (A) Blue Long Koti Kurta Indo-L,Mens (A) Blue Long Koti Kurta Indo-L,Amazon,Mens (A) Blue Long Koti Kurta Indo-L,B0CR7RS3NF,Active
129-N.b.f Fashion,IM036357N Mens Sky Embro Kurta-L,N Mens Sky Embro Kurta-L,Amazon,N Mens Sky Embro Kurta-L,B0CD2PD79Y,Active
129-N.b.f Fashion,IM314501Girls Yellow Choli 6-7 Y,Girls Yellow Choli 6-7 Y,Amazon,Girls Yellow Choli 6-7 Y,B0G5G8JP12,Active
129-N.b.f Fashion,IM036133Mens Mahendi Indo Western-XL,Mens Mahendi Indo Western-XL,Amazon,Mens Mahendi Indo Western-XL,B0966CMNZ4,Active
129-N.b.f Fashion,IM322439Womens Sky Printed Kurti Set - L,Womens Sky Printed Kurti Set - L,Amazon,Womens Sky Printed Kurti Set - L,B0G6ZRSJV9,Active
129-N.b.f Fashion,IM036649Mens Royal Red Indo Western-XXl,Mens Royal Red Indo Western-XXl,Amazon,Mens Royal Red Indo Western-XXl,B094YHZPXN,Active
129-N.b.f Fashion,IM186000Mens Maroon Indo Western Set - M,Mens Maroon Indo Western Set - M,Amazon,Mens Maroon Indo Western Set - M,B0DCZMT4G6,Active
129-N.b.f Fashion,IM035075Mens Brown Indo-M,Mens Brown Indo-M,Amazon,Mens Brown Indo-M,B0CCRR42FX,Active
129-N.b.f Fashion,IM314590Girls D Blue Wings Frock 2-3,Girls D Blue Wings Frock 2-3,Amazon,Girls D Blue Wings Frock 2-3,B0G5GFVDJ5,Active
129-N.b.f Fashion,IM271358Baby Girls Black Frock 4-5 Y,Baby Girls Black Frock 4-5 Y,Amazon,Baby Girls Black Frock 4-5 Y,B0F91R8QCN,Active
129-N.b.f Fashion,IM036245Mens Pista Embro Kurta -M,Mens Pista Embro Kurta -M,Amazon,Mens Pista Embro Kurta -M,B0BWTV118V,Active
129-N.b.f Fashion,IM186421A-Men_Black Pista Pattern KPNJ Set-M,A-Men_Black Pista Pattern KPNJ Set-M,Amazon,A-Men_Black Pista Pattern KPNJ Set-M,B0DD4G834G,Active
129-N.b.f Fashion,IM314545Girls Blue Multi Colour Choli 12-18 M,Girls Blue Multi Colour Choli 12-18 M,Amazon,Girls Blue Multi Colour Choli 12-18 M,B0G5F9CGK3,Active
129-N.b.f Fashion,IM036496Men KTPJNJ 20200821-RD-GJ -S,Men KTPJNJ 20200821-RD-GJ -S,Amazon,Men KTPJNJ 20200821-RD-GJ -S,B08GQ6XJNM,Active
129-N.b.f Fashion,IM314604Womens Yellow Kurti Set - XXL,Womens Yellow Kurti Set - XXL,Amazon,Womens Yellow Kurti Set - XXL,B0G5GBQQGX,Active
129-N.b.f Fashion,IM037383Embro Maroon Kurta Mens - XL,Embro Maroon Kurta Mens - XL,Amazon,Embro Maroon Kurta Mens - XL,B0BZYZ62R6,Active
129-N.b.f Fashion,IM271423X- Mens Black Checked Boxer -L,X- Mens Black Checked Boxer -L,Amazon,X- Mens Black Checked Boxer -L,B0FBJR9MTR,Active
129-N.b.f Fashion,IM192462Mens Long White Kurta Coffe Koti 137-L,Mens Long White Kurta Coffe Koti 137-L,Amazon,Mens Long White Kurta Coffe Koti 137-L,B0D2LDFG66,Active
129-N.b.f Fashion,IM038115Mens Blue Indo - L,Mens Blue Indo - L,Amazon,Mens Blue Indo - L,B09CMRJ8T3,Active
129-N.b.f Fashion,IM036414Mens Maroon MKPNJ- XXL,Mens Maroon MKPNJ- XXL,Amazon,Mens Maroon MKPNJ- XXL,B08KND9VC7,Active
129-N.b.f Fashion,IM186193X- Mens Grey New Mirror Work Kurta -L,X- Mens Grey New Mirror Work Kurta -L,Amazon,X- Mens Grey New Mirror Work Kurta -L,B0D73TZVHR,Active
129-N.b.f Fashion,IM037468Men Red Ranveer Indo- XXL,Men Red Ranveer Indo- XXL,Amazon,Men Red Ranveer Indo- XXL,B0BYVTRX43,Active
129-N.b.f Fashion,IM037554Mens Kohli Koti Kurta Set - L,Mens Kohli Koti Kurta Set - L,Amazon,Mens Kohli Koti Kurta Set - L,B09SWBRL7R,Active
129-N.b.f Fashion,IM314532Girls Wine S-S Choli 2-3 Y,Girls Wine S-S Choli 2-3 Y,Amazon,Girls Wine S-S Choli 2-3 Y,B0G5G6T9JS,Active
129-N.b.f Fashion,IM036643Mens RK SKY New Side Indo -M,Mens RK SKY New Side Indo -M,Amazon,Mens RK SKY New Side Indo -M,B0CPYHD2LS,Active
129-N.b.f Fashion,IM186001Mens Maroon Indo Western Set - L,Mens Maroon Indo Western Set - L,Amazon,Mens Maroon Indo Western Set - L,B0DCZMRRTB,Active
129-N.b.f Fashion,IM037625mens ranveer yellow indo - xxl,mens ranveer yellow indo - xxl,Amazon,mens ranveer yellow indo - xxl,B09815YQYX,Active
129-N.b.f Fashion,IM314534Girls Green Top Bottom 5-6 Y,Girls Green Top Bottom 5-6 Y,Amazon,Girls Green Top Bottom 5-6 Y,B0FTMHGCZR,Active
129-N.b.f Fashion,IM036786Navyblue-white Embro Kurta Set-XXL,Navyblue-white Embro Kurta Set-XXL,Amazon,Navyblue-white Embro Kurta Set-XXL,B0B6TXVYCT,Active
129-N.b.f Fashion,IM314518Girls D SKY Printed Frock 3-4,Girls D SKY Printed Frock 3-4,Amazon,Girls D SKY Printed Frock 3-4,B0G5FTP9WC,Active
129-N.b.f Fashion,IM314514Girls Cream Co-ords Set 18-24 M,Girls Cream Co-ords Set 18-24 M,Amazon,Girls Cream Co-ords Set 18-24 M,B0G5FWCLHY,Active
129-N.b.f Fashion,IM186038A-Men Blue Satin Pattern Indo Set -M,A-Men Blue Satin Pattern Indo Set -M,Amazon,A-Men Blue Satin Pattern Indo Set -M,B0DD48YM14,Active
129-N.b.f Fashion,IM038162Mens R.Yellow  Indo - XXL,Mens R.Yellow  Indo - XXL,Amazon,Mens R.Yellow  Indo - XXL,B09SYTYV9X,Active
129-N.b.f Fashion,IM036899N Mens Kohli Indo - L,N Mens Kohli Indo - L,Amazon,N Mens Kohli Indo - L,B0B4SLSDFH,Active
129-N.b.f Fashion,IM035018Mens Black Indo - XXL,Mens Black Indo - XXL,Amazon,Mens Black Indo - XXL,B0C8Z9V1N6,Active
129-N.b.f Fashion,IM036250Mens Pista Embro Kurta-XXL,Mens Pista Embro Kurta-XXL,Amazon,Mens Pista Embro Kurta-XXL,B0CD2MK1ZP,Active
129-N.b.f Fashion,IM036537Mens Black-Border Indo-L,Mens Black-Border Indo-L,Amazon,Mens Black-Border Indo-L,B0CBWTW6QQ,Active
129-N.b.f Fashion,IM036425Mens RK Mahendi Indo - L,Mens RK Mahendi Indo - L,Amazon,Mens RK Mahendi Indo - L,B0C943CZGJ,Active
129-N.b.f Fashion,IM036320Mens Lakhanvi  Sky Embro Kurta - S,Mens Lakhanvi  Sky Embro Kurta - S,Amazon,Mens Lakhanvi  Sky Embro Kurta - S,B0BWTVBNVL,Active
129-N.b.f Fashion,IM036538Mens BlackBorder Indo-M,Mens BlackBorder Indo-M,Amazon,Mens BlackBorder Indo-M,B0CBVGX25X,Active
129-N.b.f Fashion,IM035009Mens Black Gold Indo Set - L,Mens Black Gold Indo Set - L,Amazon,Mens Black Gold Indo Set - L,B0CR1J6BBG,Active
129-N.b.f Fashion,IM036100Mens Green Lakhanvi Embro Kurta- XXL,Mens Green Lakhanvi Embro Kurta- XXL,Amazon,Mens Green Lakhanvi Embro Kurta- XXL,B0BWTNBH29,Active
129-N.b.f Fashion,IM037590Mens Light-Red Jeaquard Sherwani-M,Mens Light-Red Jeaquard Sherwani-M,Amazon,Mens Light-Red Jeaquard Sherwani-M,B0CC8T6M1V,Active
129-N.b.f Fashion,IM035942Mens Kohli Indo-M,Mens Kohli Indo-M,Amazon,Mens Kohli Indo-M,B0CD2JTBN1,Active
129-N.b.f Fashion,IM322431A- Girls Blue Choli 5-6 Y,A- Girls Blue Choli 5-6 Y,Amazon,A- Girls Blue Choli 5-6 Y,B0G9KYYGTC,Active
129-N.b.f Fashion,IM036552Mens Cream Red Indo-M,Mens Cream Red Indo-M,Amazon,Mens Cream Red Indo-M,B0CBVB71SS,Active
129-N.b.f Fashion,IM037770Mens RK Red Indo - XL,Mens RK Red Indo - XL,Amazon,Mens RK Red Indo - XL,B0C9HG5BCB,Active
129-N.b.f Fashion,IM037562Mens Kohli Style Red KPNJ  - XL,Mens Kohli Style Red KPNJ  - XL,Amazon,Mens Kohli Style Red KPNJ - XL,B09B1THCXV,Active
129-N.b.f Fashion,IM271367Baby Girls Maroon  Frock 5-6 Y,Baby Girls Maroon  Frock 5-6 Y,Amazon,Baby Girls Maroon  Frock 5-6 Y,B0F91Q4WH4,Active
129-N.b.f Fashion,IM035754NavyBlue-White Embro kurta-XL,NavyBlue-White Embro kurta-XL,Amazon,NavyBlue-White Embro kurta-XL,B0CBSGNH24,Active
129-N.b.f Fashion,IM037956Red Waistcoats R - S,Red Waistcoats R - S,Amazon,Red Waistcoats R - S,B08PZK8CRH,Active
129-N.b.f Fashion,IM036602Mens Old Perrot Indo Set - L,Mens Old Perrot Indo Set - L,Amazon,Mens Old Perrot Indo Set - L,B0CR1JNJ37,Active
129-N.b.f Fashion,IM036215RM-5ZD0-EGS6,RM-5ZD0-EGS6,Amazon,RM-5ZD0-EGS6,B0CBPGQ4SY,Active
129-N.b.f Fashion,IM337627Mens Rama Indo Set - L,Mens Rama Indo Set - L,Amazon,Mens Rama Indo Set - L,B0GPD3GCHW,Active
129-N.b.f Fashion,IM037559Mens Kohli Style Red KPNJ  - L,Mens Kohli Style Red KPNJ  - L,Amazon,Mens Kohli Style Red KPNJ - L,B09B1VFK5N,Active
129-N.b.f Fashion,IM037378Dark  Red KPNJ -XXL,Dark  Red KPNJ -XXL,Amazon,Dark  Red KPNJ -XXL,B08KPH87DM,Active
129-N.b.f Fashion,IM137527Mens Red Seq Indo - M,Mens Red Seq Indo - M,Amazon,Mens Red Seq Indo - M,B0CXLYT5TZ,Active
129-N.b.f Fashion,IM036631mens ranveer yellow indo - xl,mens ranveer yellow indo - xl,Amazon,mens ranveer yellow indo - xl,B09872TPTS,Active
129-N.b.f Fashion,IM284166Baby Girls Wine Frock 2-3 Y,Baby Girls Wine Frock 2-3 Y,Amazon,Baby Girls Wine Frock 2-3 Y,B0FN44LZT4,Active
129-N.b.f Fashion,IM337619Mens Rama Indo Set - XXL,Mens Rama Indo Set - XXL,Amazon,Mens Rama Indo Set - XXL,B0GPDNYHRB,Active
129-N.b.f Fashion,IM271374X- Mens Beige Purple Boxer - S,X- Mens Beige Purple Boxer - S,Amazon,X- Mens Beige Purple Boxer - S,B0FBJX628W,Active
129-N.b.f Fashion,IM186309Mens New Blue Red Indo Set - S,Mens New Blue Red Indo Set - S,Amazon,Mens New Blue Red Indo Set - S,B0D9DGR25V,Active
129-N.b.f Fashion,IM036333Mens Sky Embro Kurta-M,Mens Sky Embro Kurta-M,Amazon,Mens Sky Embro Kurta-M,B0CD2JTM5C,Active
129-N.b.f Fashion,IM037910R.Red Koti =S,R.Red Koti =S,Amazon,R.Red Koti =S,B09TKW3Y6S,Active
129-N.b.f Fashion,IM036395Mens Dayable Maroon Indo - L,Mens Dayable Maroon Indo - L,Amazon,Mens Dayable Maroon Indo - L,B0CR48GWHS,Active
129-N.b.f Fashion,IM037914Ranveer Red Indo - S,Ranveer Red Indo - S,Amazon,Ranveer Red Indo - S,B0B87GM82W,Active
129-N.b.f Fashion,IM036564Mens Cream-Red Indo-S,Mens Cream-Red Indo-S,Amazon,Mens Cream-Red Indo-S,B0CBWR2Q3Z,Active
129-N.b.f Fashion,IM314573Girls Wine S-S Choli 4-5 Y,Girls Wine S-S Choli 4-5 Y,Amazon,Girls Wine S-S Choli 4-5 Y,B0G5FH5XYD,Active
129-N.b.f Fashion,IM036470HB-4Z1Y-NXV1,HB-4Z1Y-NXV1,Amazon,HB-4Z1Y-NXV1,B0CBPGCHQ4,Active
129-N.b.f Fashion,IM284148Baby Girls Grey Frock 18-24 M,Baby Girls Grey Frock 18-24 M,Amazon,Baby Girls Grey Frock 18-24 M,B0FN447CCP,Active
129-N.b.f Fashion,IM284164Baby Girls Light Purple Frock 3-4 Y,Baby Girls Light Purple Frock 3-4 Y,Amazon,Baby Girls Light Purple Frock 3-4 Y,B0FN45G7XG,Active
129-N.b.f Fashion,IM192474Mens - 133 Coffee Multi Jq Indo - S,Mens - 133 Coffee Multi Jq Indo - S,Amazon,Mens - 133 Coffee Multi Jq Indo - S,B0D2NTFRD6,Active
129-N.b.f Fashion,IM037907R.Red Koti = M,R.Red Koti = M,Amazon,R.Red Koti = M,B09TKVDYRG,Active
129-N.b.f Fashion,IM035995N Mens Kohli Indo-S,N Mens Kohli Indo-S,Amazon,N Mens Kohli Indo-S,B0CD2FZY6P,Active
129-N.b.f Fashion,IM314547Girls Blue Multi Colour Choli 3-4 Y,Girls Blue Multi Colour Choli 3-4 Y,Amazon,Girls Blue Multi Colour Choli 3-4 Y,B0G5FKM6V4,Active
129-N.b.f Fashion,IM034998Mens Black Dayable Indo - M,Mens Black Dayable Indo - M,Amazon,Mens Black Dayable Indo - M,B0CR45DRPP,Active
129-N.b.f Fashion,IM035311Mens Blue Indo West - S,Men's Blue Indo West - S,Amazon,Men's Blue Indo West - S,B097JV29JJ,Active
129-N.b.f Fashion,IM314530Girls D SKY Printed Frock 4-5 Y,Girls D SKY Printed Frock 4-5 Y,Amazon,Girls D SKY Printed Frock 4-5 Y,B0G5GFJ8YT,Active
129-N.b.f Fashion,IM314543Girls White Top Bottom 4-5 Y,Girls White Top Bottom 4-5 Y,Amazon,Girls White Top Bottom 4-5 Y,B0FTMKRC4M,Active
129-N.b.f Fashion,IM037377Dark  Red KPNJ -M,Dark  Red KPNJ -M,Amazon,Dark  Red KPNJ -M,B08KNG7LFQ,Active
129-N.b.f Fashion,IM035452Mens Blue Silver Indo - M,Mens Blue Silver Indo - M,Amazon,Mens Blue Silver Indo - M,B0B84ZP8GZ,Active
129-N.b.f Fashion,IM284196Baby Girls Grey Frock 12-18 M,Baby Girls Grey Frock 12-18 M,Amazon,Baby Girls Grey Frock 12-18 M,B0FN43L388,Active
129-N.b.f Fashion,IM192426Mens Long White Kurta Coffe Koti 137-S,Mens Long White Kurta Coffe Koti 137-S,Amazon,Mens Long White Kurta Coffe Koti 137-S,B0D2LFKTDC,Active
129-N.b.f Fashion,IM035875N Mens Brown Indo-XXL,N Mens Brown Indo-XXL,Amazon,N Mens Brown Indo-XXL,B0CBVKPJ52,Active
129-N.b.f Fashion,IM036485Men Cream Gold Indo-M,Men Cream Gold Indo-M,Amazon,Men Cream Gold Indo-M,B0CBV5PFKB,Active
129-N.b.f Fashion,IM037216Mens Pink Only Koti-M,Mens Pink Only Koti-M,Amazon,Mens Pink Only Koti-M,B0CFV3BXW5,Active
129-N.b.f Fashion,IM284155Baby Girls Grey Frock 4-5 Y,Baby Girls Grey Frock 4-5 Y,Amazon,Baby Girls Grey Frock 4-5 Y,B0FN45CTM5,Active
129-N.b.f Fashion,IM038342Mens-CottonKurta-M,Mens-CottonKurta-M,Amazon,Mens-CottonKurta-M,B0CBMP99X9,Active
129-N.b.f Fashion,IM284185A- Baby Girls Black Frock 2-3 Y,A- Baby Girls Black Frock 2-3 Y,Amazon,A- Baby Girls Black Frock 2-3 Y,B0FN42YVZP,Active
129-N.b.f Fashion,IM137535Mens Seq New Blue Indo - XL,Mens Seq New Blue Indo - XL,Amazon,Mens Seq New Blue Indo - XL,B0CXJB1X3L,Active
129-N.b.f Fashion,IM035556Mens RK Blue Fancy Indo - M,Mens RK Blue Fancy Indo - M,Amazon,Mens RK Blue Fancy Indo - M,B0C78FP21F,Active
129-N.b.f Fashion,IM035105Mens Mirrar Work Black Kurta - XXL,Mens Mirrar Work Black Kurta - XXL,Amazon,Mens Mirrar Work Black Kurta - XXL,B0CBLV3YXZ,Active
129-N.b.f Fashion,IM314558Girls D SKY Printed Frock 12-18 M,Girls D SKY Printed Frock 12-18 M,Amazon,Girls D SKY Printed Frock 12-18 M,B0G5FHXHSV,Active
129-N.b.f Fashion,IM036556Mens Cream-Gold  Indo-XXL,Mens Cream-Gold Indo-XXL,Amazon,Mens Cream-Gold Indo-XXL,B0CBVJLCMM,Active
129-N.b.f Fashion,IM037549Mens Embro Red Kurta - XXL,Mens Embro Red Kurta - XXL,Amazon,Mens Embro Red Kurta - XXL,B0BWRZLFSG,Active
129-N.b.f Fashion,IM036243Mens Pista Embro Kurta - S,Mens Pista Embro Kurta - S,Amazon,Mens Pista Embro Kurta - S,B0BWTWJ86P,Active
129-N.b.f Fashion,IM037351Mens Ringni Dayable Indo - S,Mens Ringni Dayable Indo - S,Amazon,Mens Ringni Dayable Indo - S,B0CR47M4Q9,Active
129-N.b.f Fashion,IM037359821-NEW-NJ-L,821-NEW-NJ-L,Amazon,821-NEW-NJ-L,B08QMVNFGG,Active
129-N.b.f Fashion,IM137551Mens A- Blue Seq Indo - S,Mens A- Blue Seq Indo - S,Amazon,Mens A- Blue Seq Indo - S,B0CXPNWNNS,Active
129-N.b.f Fashion,IM037927Red Indo For Mens - XXL,Red Indo For Mens - XXL,Amazon,Red Indo For Mens - XXL,B0BX485H63,Active
129-N.b.f Fashion,IM284245A-Men Pista Koti Kurta_2XL,A-Men Pista Koti Kurta_2XL,Amazon,A-Men Pista Koti Kurta_2XL,B0FM7T6BVV,Active
129-N.b.f Fashion,IM035586Mens RK New Blue Indo-M,Mens RK New Blue Indo-M,Amazon,Mens RK New Blue Indo-M,B0C94353TH,Active
129-N.b.f Fashion,IM271371Mens Blue New Work Kurta - M,Mens Blue New Work Kurta - M,Amazon,Mens Blue New Work Kurta - M,B0F2N5F3J8,Active
129-N.b.f Fashion,IM035126Mens-Kurta-M,Mens-Kurta-M,Amazon,Mens-Kurta-M,B0CBMTHSZ2,Active
129-N.b.f Fashion,IM137528Mens Red Seq Indo - S,Mens Red Seq Indo - S,Amazon,Mens Red Seq Indo - S,B0CXM8BJFV,Active
129-N.b.f Fashion,IM337625Mens Black Rani Indo Set - L,Mens Black Rani Indo Set - L,Amazon,Mens Black Rani Indo Set - L,B0GPD9WDWF,Active
129-N.b.f Fashion,IM036887Mens Kohli Indo -XL,Mens Kohli Indo -XL,Amazon,Mens Kohli Indo -XL,B0B4SN1Q3C,Active
129-N.b.f Fashion,IM035141N Black long Koti Kurta-XXL,N Black long Koti Kurta-XXL,Amazon,N Black long Koti Kurta-XXL,B0CCRMGF5V,Active
129-N.b.f Fashion,IM035729N Mens RK New Blue Indo - XL,N Mens RK New Blue Indo - XL,Amazon,N Mens RK New Blue Indo - XL,B0C9DPN3QZ,Active
129-N.b.f Fashion,IM038317Mens Yellow Ranveer Indo-L,Mens Yellow Ranveer Indo-L,Amazon,Mens Yellow Ranveer Indo-L,B09CDTY8PJ,Active
129-N.b.f Fashion,IM284230X-Mens Maroon Satin Pattern Indo-M_new,X-Mens Maroon Satin Pattern Indo-M_new,Amazon,X-Mens Maroon Satin Pattern Indo-M_new,B0FM7S1LTW,Active
129-N.b.f Fashion,IM035960Mens RK New Gold Indo - XXL,Mens RK New Gold Indo - XXL,Amazon,Mens RK New Gold Indo - XXL,B0C9D2BFYP,Active
129-N.b.f Fashion,IM037582Mens Light-Red Ijequard indo-XL,Mens Light-Red Ijequard indo-XL,Amazon,Mens Light-Red Ijequard indo-XL,B0CC8T1WB5,Active
129-N.b.f Fashion,IM034951Black MIrror Work Cotton Kurta-M,Black MIrror Work Cotton Kurta-M,Amazon,Black MIrror Work Cotton Kurta-M,B0CBS6P2NQ,Active
129-N.b.f Fashion,IM037455Men R-C NewSide Indo Set - M,Men R-C NewSide Indo Set - M,Amazon,Men R-C NewSide Indo Set - M,B0CR1GSXP5,Active
129-N.b.f Fashion,IM314607Girls Black Top Bottom 9-10 Y,Girls Black Top Bottom 9-10 Y,Amazon,Girls Black Top Bottom 9-10 Y,B0FTMJW7FX,Active
129-N.b.f Fashion,IM192428Mens 125 Black Green Indo Set - S,Mens 125 Black Green Indo Set - S,Amazon,Mens 125 Black Green Indo Set - S,B0D2NW56P2,Active
129-N.b.f Fashion,IM03644251-3YWL-YBO9,51-3YWL-YBO9,Amazon,51-3YWL-YBO9,B0CBPF7GDN,Active
129-N.b.f Fashion,IM036244Mens Pista Embro Kurta - XL,Mens Pista Embro Kurta - XL,Amazon,Mens Pista Embro Kurta - XL,B0BWTX7PFL,Active
129-N.b.f Fashion,IM038383N Mens Yellow JQ Ranveer Indo-L,N Mens Yellow JQ Ranveer Indo-L,Amazon,N Mens Yellow JQ Ranveer Indo-L,B0BX3TB9NT,Active
129-N.b.f Fashion,IM036358N Mens Sky Embro Kurta-M,N Mens Sky Embro Kurta-M,Amazon,N Mens Sky Embro Kurta-M,B0CD2LY9S3,Active
129-N.b.f Fashion,IM036486Men Cream Gold Indo-S,Men Cream Gold Indo-S,Amazon,Men Cream Gold Indo-S,B0CBV7DPHG,Active
129-N.b.f Fashion,IM186404Mens Black Kurta Pattern Koti Set - L,Mens Black Kurta Pattern Koti Set - L,Amazon,Mens Black Kurta Pattern Koti Set - L,B0DCZMZGP5,Active
129-N.b.f Fashion,IM035730N Mens RK New Blue Indo - XXL,N Mens RK New Blue Indo - XXL,Amazon,N Mens RK New Blue Indo - XXL,B0C9D55R6L,Active
129-N.b.f Fashion,IM038109Men Yellow Ranveer Indo- XXL,Men Yellow Ranveer Indo- XXL,Amazon,Men Yellow Ranveer Indo- XXL,B0BYVPQVJ7,Active
129-N.b.f Fashion,IM037584Mens Light-Red indo Sherwani-L,Mens Light-Red indo Sherwani-L,Amazon,Mens Light-Red indo Sherwani-L,B0CC8P8867,Active
129-N.b.f Fashion,IM036356Mens Sky Lakhanvi Kurta Set - XXL,Mens Sky Lakhanvi Kurta Set - XXL,Amazon,Mens Sky Lakhanvi Kurta Set - XXL,B0BWRXLW9T,Active
129-N.b.f Fashion,IM186046A-Men Yellow Satin Pattern Indo Set -XL,A-Men Yellow Satin Pattern Indo Set -XL,Amazon,A-Men Yellow Satin Pattern Indo Set -XL,B0DD47PQQH,Active
129-N.b.f Fashion,IM035934Mens Gold JQ Ranveer Indo-XL,Mens Gold JQ Ranveer Indo-XL,Amazon,Mens Gold JQ Ranveer Indo-XL,B0BX3XBR15,Active
129-N.b.f Fashion,IM035832Mens Dayable Coffee Indo Set- S,Mens Dayable Coffee Indo Set- S,Amazon,Mens Dayable Coffee Indo Set- S,B0CR94YXZY,Active
129-N.b.f Fashion,IM036539Mens Black-Border Indo-M,Mens Black-Border Indo-M,Amazon,Mens Black-Border Indo-M,B0CBWTFZNZ,Active
129-N.b.f Fashion,IM037768Mens RK Red Indo - M,Mens RK Red Indo - M,Amazon,Mens RK Red Indo - M,B0C9HVDKQH,Active
129-N.b.f Fashion,IM035582Mens RK New Blue Indo - S,Mens RK New Blue Indo - S,Amazon,Mens RK New Blue Indo - S,B0C72F2B7S,Active
129-N.b.f Fashion,IM036417Mens Marron Embro Kurta - S,Mens Marron Embro Kurta - S,Amazon,Mens Marron Embro Kurta - S,B0BWTX4Z8Q,Active
129-N.b.f Fashion,IM284226X-Mens Black Long Koti Sherwani-XL_new,X-Mens Black Long Koti Sherwani-XL_new,Amazon,X-Mens Black Long Koti Sherwani-XL_new,B0FM7S82Z1,Active
129-N.b.f Fashion,IM036594Mens Marron Dayable Indo Set - XL,Mens Marron Dayable Indo Set - XL,Amazon,Mens Marron Dayable Indo Set - XL,B0CR94RLZ4,Active
129-N.b.f Fashion,IM036103Mens Green Lakhanvi Kurta Set - S,Mens Green Lakhanvi Kurta Set - S,Amazon,Mens Green Lakhanvi Kurta Set - S,B0BWRWMMT2,Active
129-N.b.f Fashion,IM037632Mens Red  Lakhanvi kurta- XXL,Mens Red  Lakhanvi kurta- XXL,Amazon,Mens Red  Lakhanvi kurta- XXL,B0B5HFJSXQ,Active
129-N.b.f Fashion,IM036613Mens Ranveer Indo Westen-L,Mens Ranveer Indo Westen-L,Amazon,Mens Ranveer Indo Westen-L,B094XXCRMR,Active
129-N.b.f Fashion,IM035069Mens Black Silver Indo - M,Mens Black Silver Indo - M,Amazon,Mens Black Silver Indo - M,B0CJFQKT1K,Active
129-N.b.f Fashion,IM035661Mens Temple Blue New Indo-L,Mens Temple Blue New Indo-L,Amazon,Mens Temple Blue New Indo-L,B0CQ2DG14G,Active
129-N.b.f Fashion,IM271384X- Mens Maroon Boxer - XL,X- Mens Maroon Boxer - XL,Amazon,X- Mens Maroon Boxer - XL,B0FBGVJ1S3,Active
129-N.b.f Fashion,IM284240A - Mens Black Seq Long Koti Kurta_XL,A - Mens Black Seq Long Koti Kurta_XL,Amazon,A - Mens Black Seq Long Koti Kurta_XL,B0FM82L3WQ,Active
129-N.b.f Fashion,IM038167mens r.yellow indo- S,mens r.yellow indo- S,Amazon,mens r.yellow indo- S,B09CMVM5MY,Active
129-N.b.f Fashion,IM035941Mens Kohli Indo-L,Mens Kohli Indo-L,Amazon,Mens Kohli Indo-L,B0CD2JMGGP,Active
129-N.b.f Fashion,IM035277Mens (A) Blue Long Koti Kurta Indo-XXL,Mens (A) Blue Long Koti Kurta Indo-XXL,Amazon,Mens (A) Blue Long Koti Kurta Indo-XXL,B0CR7S65YY,Active
129-N.b.f Fashion,IM037104Mens Dark Pink Emb Lakhanvi Kurta - XL,Mens Dark Pink Emb Lakhanvi Kurta - XL,Amazon,Mens Dark Pink Emb Lakhanvi Kurta - XL,B0BWRN5HGV,Active
129-N.b.f Fashion,IM036926Mens Kohli Cream Red Indo-M,Mens Kohli Cream Red Indo-M,Amazon,Mens Kohli Cream Red Indo-M,B0CD27YWD2,Active
129-N.b.f Fashion,IM314513Girls Perot Top Bottom 4-5 Y,Girls Perot Top Bottom 4-5 Y,Amazon,Girls Perot Top Bottom 4-5 Y,B0FTMK8MC2,Active
129-N.b.f Fashion,IM284215A-Men Blue Long Koti Kurta_L,A-Men Blue Long Koti Kurta_L,Amazon,A-Men Blue Long Koti Kurta_L,B0FM82YZG9,Active
129-N.b.f Fashion,IM322441Womens Sky Printed Kurti Set - XXL,Womens Sky Printed Kurti Set - XXL,Amazon,Womens Sky Printed Kurti Set - XXL,B0G6ZFMDTG,Active
129-N.b.f Fashion,IM137623Mens Black Seq Long Koti Kurta - L,Mens Black Seq Long Koti Kurta - L,Amazon,Mens Black Seq Long Koti Kurta - L,B0CXJDHTL3,Active
129-N.b.f Fashion,IM036565Mens Cream-Red Indo-XL,Mens Cream-Red Indo-XL,Amazon,Mens Cream-Red Indo-XL,B0CBWS7F6F,Active
129-N.b.f Fashion,IM186308Mens New Blue Red Indo Set - XXL,Mens New Blue Red Indo Set - XXL,Amazon,Mens New Blue Red Indo Set - XXL,B0D9DG5NYP,Active
129-N.b.f Fashion,IM035302Mens Blue Embro Kurta - XXL,Mens Blue Embro Kurta - XXL,Amazon,Mens Blue Embro Kurta - XXL,B0B862LXM8,Active
129-N.b.f Fashion,IM271359Baby Girls Red Frock 4-5 Y,Baby Girls Red Frock 4-5 Y,Amazon,Baby Girls Red Frock 4-5 Y,B0F91P9ZTR,Active
129-N.b.f Fashion,IM192413Mens_118 Black Yellow Indo Set - Xl,Mens_118 Black Yellow Indo Set - Xl,Amazon,Mens_118 Black Yellow Indo Set - Xl,B0D2NS2FRN,Active
129-N.b.f Fashion,IM192409Mens 124 Black Blue Indo - XL,Mens 124 Black Blue Indo - XL,Amazon,Mens 124 Black Blue Indo - XL,B0D2NV8SX4,Active
129-N.b.f Fashion,IM036355Mens Sky Lakhanvi Kurta Set - XL,Mens Sky Lakhanvi Kurta Set - XL,Amazon,Mens Sky Lakhanvi Kurta Set - XL,B0BWRZL3JF,Active
129-N.b.f Fashion,IM037140Mens Light Pink Embro Kurta - M,Mens Light Pink Embro Kurta - M,Amazon,Mens Light Pink Embro Kurta - M,B0BWTX4X15,Active
129-N.b.f Fashion,IM271408Mens Light Blue  Seq Kurta Set - M,Mens Light Blue  Seq Kurta Set - M,Amazon,Mens Light Blue  Seq Kurta Set - M,B0F9X7QNRG,Active
129-N.b.f Fashion,IM137530Mens Seq New Blue Indo - M,Mens Seq New Blue Indo - M,Amazon,Mens Seq New Blue Indo - M,B0CXJ9K27Q,Active
129-N.b.f Fashion,IM314516Girls SKY Printed Frock 2-3,Girls SKY Printed Frock 2-3,Amazon,Girls SKY Printed Frock 2-3,B0G5GQ4YG3,Active
129-N.b.f Fashion,IM186312Mens New Blue Red Indo Set - M,Mens New Blue Red Indo Set - M,Amazon,Mens New Blue Red Indo Set - M,B0D9DJH556,Active
129-N.b.f Fashion,IM036695N Mens Black-Border Indo-S,N Mens Black-Border Indo-S,Amazon,N Mens Black-Border Indo-S,B0CBWVNLFF,Active
129-N.b.f Fashion,IM036693N Mens Black Long Koti Sherwani-S,N Mens Black Long Koti Sherwani-S,Amazon,N Mens Black Long Koti Sherwani-S,B0CFDVRKQF,Active
129-N.b.f Fashion,IM035784X Mens Blue Indo - L,X Mens Blue Indo - L,Amazon,X Mens Blue Indo - L,B097HQ71KH,Active
129-N.b.f Fashion,IM037322Mens-cotton MirrorKurta-L,Mens-cotton MirrorKurta-L,Amazon,Mens-cotton MirrorKurta-L,B0CBMML6XB,Active
129-N.b.f Fashion,IM036427Mens RK Mahendi Indo - S,Mens RK Mahendi Indo - S,Amazon,Mens RK Mahendi Indo - S,B0C9466CHK,Active
129-N.b.f Fashion,IM037302Mens Dayable Purrple Indo - L,Mens Dayable Purrple Indo - L,Amazon,Mens Dayable Purrple Indo - L,B0CR48L4QK,Active
129-N.b.f Fashion,IM035312Mens Blue Indo West - XL,Men's Blue Indo West - XL,Amazon,Men's Blue Indo West - XL,B097JTGCQL,Active
129-N.b.f Fashion,IM037611Mens R@nveer Red Indo -  M,Mens R@nveer Red Indo -  M,Amazon,Mens R@nveer Red Indo -  M,B09Y8W3Y75,Active
129-N.b.f Fashion,IM035267Men-KTPJNJ-20200821-Blue - -XXL,Men-KTPJNJ-20200821-Blue - -XXL,Amazon,Men-KTPJNJ-20200821-Blue - -XXL,B08W1TP5RM,Active
129-N.b.f Fashion,IM271347Mens Lime Green Seq Kurta Set - XL,Mens Lime Green Seq Kurta Set - XL,Amazon,Mens Lime Green Seq Kurta Set - XL,B0F9XCXFF6,Active
129-N.b.f Fashion,IM037293Mens Dayable Coffee Checked Indo- M,Mens Dayable Coffee Checked Indo- M,Amazon,Mens Dayable Coffee Checked Indo- M,B0CR46V7KH,Active
129-N.b.f Fashion,IM036532Mens Black Long Koti Sherwani-M,Mens Black Long Koti Sherwani-M,Amazon,Mens Black Long Koti Sherwani-M,B0CFDQFBPN,Active
129-N.b.f Fashion,IM192464Mens - 133 Coffee Multi Jq Indo - L,Mens - 133 Coffee Multi Jq Indo - L,Amazon,Mens - 133 Coffee Multi Jq Indo - L,B0D2NVHFX8,Active
129-N.b.f Fashion,IM036882mens kohli indo - M,mens kohli indo - M,Amazon,mens kohli indo - M,B09PNQPVNP,Active
129-N.b.f Fashion,IM036644Mens RK SKY New Side Indo -S,Mens RK SKY New Side Indo -S,Amazon,Mens RK SKY New Side Indo -S,B0CPYH9TYD,Active
129-N.b.f Fashion,IM037954Red Waistcoats - M,Red Waistcoats - M,Amazon,Red Waistcoats - M,B08PZLF1XN,Active
129-N.b.f Fashion,IM035485Mens Embro Blue Kurta - S,Mens Embro Blue Kurta - S,Amazon,Mens Embro Blue Kurta - S,B0BWTLM5WR,Active
129-N.b.f Fashion,IM284150Baby Girls Wine Frock 3-4 Y,Baby Girls Wine Frock 3-4 Y,Amazon,Baby Girls Wine Frock 3-4 Y,B0FN471X7M,Active
129-N.b.f Fashion,IM192410Mens Cream Cotton Kurta Wine Koti - XXL,Mens Cream Cotton Kurta Wine Koti - XXL,Amazon,Mens Cream Cotton Kurta Wine Koti - XXL,B0D4555CB2,Active
129-N.b.f Fashion,IM037568Mens Kohli Style Red KPNJ - XXL,Mens Kohli Style Red KPNJ - XXL,Amazon,Mens Kohli Style Red KPNJ - XXL,B09B1TZM7K,Active
129-N.b.f Fashion,IM036778Navy Blue-White Embro Kurta Set-L,Navy Blue-White Embro Kurta Set-L,Amazon,Navy Blue-White Embro Kurta Set-L,B0B6VRV316,Active
129-N.b.f Fashion,IM186026Mens Red_Blue Patte Sherwani- XL,Mens Red_Blue Patte Sherwani- XL,Amazon,Mens Red_Blue Patte Sherwani- XL,B0DD7FW38Z,Active
129-N.b.f Fashion,IM037171Mens Pink  Jq New Indo - L,Mens Pink  Jq New Indo - L,Amazon,Mens Pink  Jq New Indo - L,B0CQ25RH7F,Active
129-N.b.f Fashion,IM035006Mens Black Dayable Indo Set - S,Mens Black Dayable Indo Set - S,Amazon,Mens Black Dayable Indo Set - S,B0CR9476JB,Active
