Vendor Code,Master SKU,SKU,Channel,Channel SKU,Identifier,Status (Active / Inactive)
129-N.b.f Fashion,IM314531Girls Green Top Bottom 3-4 Y,Girls Green Top Bottom 3-4 Y,Amazon,Girls Green Top Bottom 3-4 Y,B0FTMKV2JY,Active
129-N.b.f Fashion,IM035813Mens AK Brown Indo - L,Mens AK Brown Indo - L,Amazon,Mens AK Brown Indo - L,B0C9CLV3D9,Active
129-N.b.f Fashion,IM322456Womens Sky Printed Kurti Set - XL,Womens Sky Printed Kurti Set - XL,Amazon,Womens Sky Printed Kurti Set - XL,B0G6ZP61WS,Active
129-N.b.f Fashion,IM037959Red-White Embro kurta-XL,Red-White Embro kurta-XL,Amazon,Red-White Embro kurta-XL,B0CBSJBN44,Active
129-N.b.f Fashion,IM035073Mens Black Silver Indo - XXL,Mens Black Silver Indo - XXL,Amazon,Mens Black Silver Indo - XXL,B0CJFRXYDR,Active
129-N.b.f Fashion,IM035133Mens-Mirror-Kurta-XL,Mens-Mirror-Kurta-XL,Amazon,Mens-Mirror-Kurta-XL,B0CBMPC4X6,Active
129-N.b.f Fashion,IM036608Mens R. Red Indo - XXL,Mens R. Red Indo - XXL,Amazon,Mens R. Red Indo - XXL,B09CMSHWNK,Active
129-N.b.f Fashion,IM271403X- Mens grey Boxer - L,X- Mens grey Boxer - L,Amazon,X- Mens grey Boxer - L,B0FBKBQMQR,Active
129-N.b.f Fashion,IM137537A Mens Blue Seq Koti Kurta Set 802- L,A Mens Blue Seq Koti Kurta Set 802- L,Amazon,A Mens Blue Seq Koti Kurta Set 802- L,B0CXPPFHWY,Active
129-N.b.f Fashion,IM036445B2-VOPI-98S0,B2-VOPI-98S0,Amazon,B2-VOPI-98S0,B0CBPHVC4Q,Active
129-N.b.f Fashion,IM322449A- Girls Black Choli 7-8 Y,A- Girls Black Choli 7-8 Y,Amazon,A- Girls Black Choli 7-8 Y,B0G5Z38PC8,Active
129-N.b.f Fashion,IM037695Mens Red JQ Ranveer Indo-M,Mens Red JQ Ranveer Indo-M,Amazon,Mens Red JQ Ranveer Indo-M,B0BX3Y7NGT,Active
129-N.b.f Fashion,IM284208Mens Black Indo_XL,Mens Black Indo_XL,Amazon,Mens Black Indo_XL,B0FM85SPW7,Active
129-N.b.f Fashion,IM035109Mens RK Black Indo - S,Mens RK Black Indo - S,Amazon,Mens RK Black Indo - S,B0C9DNKF5H,Active
129-N.b.f Fashion,IM037157Mens Light-Pink Embro Kurta-M,Mens Light-Pink Embro Kurta-M,Amazon,Mens Light-Pink Embro Kurta-M,B0CD2KSMF8,Active
129-N.b.f Fashion,IM036519Men-KTPJNJ-20200821-RD-GJ-L,Men-KTPJNJ-20200821-RD-GJ-L,Amazon,Men-KTPJNJ-20200821-RD-GJ-L,B08FTFZ6Q7,Active
129-N.b.f Fashion,IM037382Embro Maroon Kurta Mens - S,Embro Maroon Kurta Mens - S,Amazon,Embro Maroon Kurta Mens - S,B0BZYZB8WP,Active
129-N.b.f Fashion,IM037492MEN-821-KPNJ-RED-L,MEN-821-KPNJ-RED-L,Amazon,MEN-821-KPNJ-RED-L,B08QMRRYCB,Active
129-N.b.f Fashion,IM186023Mens Rama Indo Western Set - XXL,Mens Rama Indo Western Set - XXL,Amazon,Mens Rama Indo Western Set - XXL,B0DCZDP2QL,Active
129-N.b.f Fashion,IM035564Mens RK Blue Indo - XXL,Mens RK Blue Indo - XXL,Amazon,Mens RK Blue Indo - XXL,B0C77DNNS3,Active
129-N.b.f Fashion,IM037911Ranvee Red Indo - M,Ranvee Red Indo - M,Amazon,Ranvee Red Indo - M,B092W8TKWR,Active
129-N.b.f Fashion,IM037720Mens Red Lakhanvi Kurta - M,Mens Red Lakhanvi Kurta - M,Amazon,Mens Red Lakhanvi Kurta - M,B0B5L9X2DC,Active
129-N.b.f Fashion,IM314576Girls Cream Co-ords Set 12-18 M,Girls Cream Co-ords Set 12-18 M,Amazon,Girls Cream Co-ords Set 12-18 M,B0G5G3BR71,Active
129-N.b.f Fashion,IM034946Black long Koti Kurta-M,Black long Koti Kurta-M,Amazon,Black long Koti Kurta-M,B0CCRXY3HP,Active
129-N.b.f Fashion,IM036509men ranveer red indo - s,men ranveer red indo - s,Amazon,men ranveer red indo - s,B099RLC3TC,Active
129-N.b.f Fashion,IM186029Mens Yellow Satin Pattern Indo - L,Mens Yellow Satin Pattern Indo - L,Amazon,Mens Yellow Satin Pattern Indo - L,B0DCZDZ8NS,Active
129-N.b.f Fashion,IM314539Womens Blue Kurti Set - S,Womens Blue Kurti Set - S,Amazon,Womens Blue Kurti Set - S,B0G5GD3P4Y,Active
129-N.b.f Fashion,IM137548A- Mens Green Jodhpuri Kurta 801- XXL,A- Mens Green Jodhpuri Kurta 801- XXL,Amazon,A- Mens Green Jodhpuri Kurta 801- XXL,B0CXPNKXDX,Active
129-N.b.f Fashion,IM284195Baby Girls Light Purple Frock 12-18 M,Baby Girls Light Purple Frock 12-18 M,Amazon,Baby Girls Light Purple Frock 12-18 M,B0FN43XTL7,Active
129-N.b.f Fashion,IM035920Mens Gold Indo West - XXL,Mens Gold Indo West - XXL,Amazon,Mens Gold Indo West - XXL,B09BNVWZJY,Active
129-N.b.f Fashion,IM035348Mens Blue JQ Ranveer Indo-S,Mens Blue JQ Ranveer Indo-S,Amazon,Mens Blue JQ Ranveer Indo-S,B0BX432PSQ,Active
129-N.b.f Fashion,IM186164Mens New B & B Kurta Nehru JSet - M,Mens New B & B Kurta Nehru JSet - M,Amazon,Mens New B & B Kurta Nehru JSet - M,B0DCZQRQ2J,Active
129-N.b.f Fashion,IM036503Men Multicolor Spotted Kurta Set-XXL,Men Multicolor Spotted Kurta Set-XXL,Amazon,Men Multicolor Spotted Kurta Set-XXL,B0B6RS9DSX,Active
129-N.b.f Fashion,IM035008Mens Black Dayable Indo Set - XXL,Mens Black Dayable Indo Set - XXL,Amazon,Mens Black Dayable Indo Set - XXL,B0CR8VDRZG,Active
129-N.b.f Fashion,IM035676Mens-20821-New Red-L,Mens-20821-New Red-L,Amazon,Mens-20821-New Red-L,B08RBXJH9V,Active
129-N.b.f Fashion,IM192478Mens Cream Cotton Kurta Cream Koti - L,Mens Cream Cotton Kurta Cream Koti - L,Amazon,Mens Cream Cotton Kurta Cream Koti - L,B0D455WF7P,Active
129-N.b.f Fashion,IM314568Girls Yellow Choli 4-5 Y,Girls Yellow Choli 4-5 Y,Amazon,Girls Yellow Choli 4-5 Y,B0G5GLP7SX,Active
129-N.b.f Fashion,IM284169A- Baby Girls Maroon Frock 18-24 M,A- Baby Girls Maroon Frock 18-24 M,Amazon,A- Baby Girls Maroon Frock 18-24 M,B0FN449RQY,Active
129-N.b.f Fashion,IM284217A-Men Blue Long Koti Kurta_XL,A-Men Blue Long Koti Kurta_XL,Amazon,A-Men Blue Long Koti Kurta_XL,B0FM7ZSM5V,Active
129-N.b.f Fashion,IM036145Mens Mahendi Jeaquard Kurta-XL,Mens Mahendi Jeaquard Kurta-XL,Amazon,Mens Mahendi Jeaquard Kurta-XL,B0CCVS81HQ,Active
129-N.b.f Fashion,IM037657Mens Red Ijequard indo-XL,Mens Red Ijequard indo-XL,Amazon,Mens Red Ijequard indo-XL,B0CC8S79BX,Active
129-N.b.f Fashion,IM284206Mens Black Indo_L,Mens Black Indo_L,Amazon,Mens Black Indo_L,B0FM8638J5,Active
129-N.b.f Fashion,IM036844Men Cream New Jq Indo - L,Men Cream New Jq Indo - L,Amazon,Men Cream New Jq Indo - L,B0CR1GZBY8,Active
129-N.b.f Fashion,IM036745X Mens Cream-gold Indo-XL,X Mens Cream-gold Indo-XL,Amazon,X Mens Cream-gold Indo-XL,B0CBV7HQXB,Active
129-N.b.f Fashion,IM192446Mens Long White Kurta Coffe Koti 137-XXL,Mens Long White Kurta Coffe Koti 137-XXL,Amazon,Mens Long White Kurta Coffe Koti 137-XXL,B0D2LGHX7S,Active
129-N.b.f Fashion,IM036901X Mens Kohli Indo - M,X Mens Kohli Indo - M,Amazon,X Mens Kohli Indo - M,B0BQCC7QLL,Active
129-N.b.f Fashion,IM035077Mens Brown Indo-XL,Mens Brown Indo-XL,Amazon,Mens Brown Indo-XL,B0CCRNS4ZR,Active
129-N.b.f Fashion,IM037333Purple Mirrir Work Kurta-M,Purple Mirrir Work Kurta-M,Amazon,Purple Mirrir Work Kurta-M,B0CBS3QKZG,Active
129-N.b.f Fashion,IM271376X- Mens Beige Purple Boxer - XXL,X- Mens Beige Purple Boxer - XXL,Amazon,X- Mens Beige Purple Boxer - XXL,B0FBJL44Y3,Active
129-N.b.f Fashion,IM036597Mens Multicolour Indowesten-S,Mens Multicolour Indowesten-S,Amazon,Mens Multicolour Indowesten-S,B0951QM82X,Active
129-N.b.f Fashion,IM037109Mens Dark Pink Embroidery Kurta - XXL,Mens Dark Pink Embroidery Kurta - XXL,Amazon,Mens Dark Pink Embroidery Kurta - XXL,B0BWTSBTPM,Active
129-N.b.f Fashion,IM036098Mens Green Lakhanvi Embro Kurta- S,Mens Green Lakhanvi Embro Kurta- S,Amazon,Mens Green Lakhanvi Embro Kurta- S,B0BWTPGKY8,Active
129-N.b.f Fashion,IM036945Mens Orange Daman Indo-L,Mens Orange Daman Indo-L,Amazon,Mens Orange Daman Indo-L,B0CG39Q5MJ,Active
129-N.b.f Fashion,IM038413Viscose Chikankari Kurta Yellow-XXL,Viscose Chikankari Kurta Yellow-XXL,Amazon,Viscose Chikankari Kurta Yellow-XXL,B0CBTS5H23,Active
129-N.b.f Fashion,IM036059Men Green Silver Indo - XL,Men Green Silver Indo - XL,Amazon,Men Green Silver Indo - XL,B0B84YLBY9,Active
129-N.b.f Fashion,IM186031Mens Yellow Satin Pattern Indo - XXL,Mens Yellow Satin Pattern Indo - XXL,Amazon,Mens Yellow Satin Pattern Indo - XXL,B0DCZCNHYM,Active
129-N.b.f Fashion,IM036542Mens BlackBorder Indo-XL,Mens BlackBorder Indo-XL,Amazon,Mens BlackBorder Indo-XL,B0CBVJL2YK,Active
129-N.b.f Fashion,IM037363821-NEW-NJ-XXL,821-NEW-NJ-XXL,Amazon,821-NEW-NJ-XXL,B08QMH94SL,Active
129-N.b.f Fashion,IM035880NS-WXEI-DHSU,NS-WXEI-DHSU,Amazon,NS-WXEI-DHSU,B0CBPGVBRP,Active
129-N.b.f Fashion,IM284199Baby Girls Light Purple Frock 2-3 Y,Baby Girls Light Purple Frock 2-3 Y,Amazon,Baby Girls Light Purple Frock 2-3 Y,B0FN46GZRN,Active
129-N.b.f Fashion,IM037270N Mens Light-pink Embro Kurta-S,N Mens Light-pink Embro Kurta-S,Amazon,N Mens Light-pink Embro Kurta-S,B0CD2KBTPB,Active
129-N.b.f Fashion,IM037158Mens Light-Pink Embro Kurta-S,Mens Light-Pink Embro Kurta-S,Amazon,Mens Light-Pink Embro Kurta-S,B0CD2KXHGD,Active
129-N.b.f Fashion,IM037849N Mens Red Indo-L,N Mens Red Indo-L,Amazon,N Mens Red Indo-L,B0CBVFLJ4K,Active
129-N.b.f Fashion,IM035253men ranveer blue indo - m,men ranveer blue indo - m,Amazon,men ranveer blue indo - m,B0986Z84C2,Active
129-N.b.f Fashion,IM037594Mens Light-Red Jequard Sherwani-L,Mens Light-Red Jequard Sherwani-L,Amazon,Mens Light-Red Jequard Sherwani-L,B0CC8WP8HW,Active
129-N.b.f Fashion,IM284174A- Baby Girls Black Frock 3-4 Y,A- Baby Girls Black Frock 3-4 Y,Amazon,A- Baby Girls Black Frock 3-4 Y,B0FN448ZZS,Active
129-N.b.f Fashion,IM037244Mens Zade Pink Jq New Indo - XXL,Mens Zade Pink Jq New Indo - XXL,Amazon,Mens Zade Pink Jq New Indo - XXL,B0CR1HZBWR,Active
129-N.b.f Fashion,IM036097Mens Green Lakhanvi Embro Kurta- M,Mens Green Lakhanvi Embro Kurta- M,Amazon,Mens Green Lakhanvi Embro Kurta- M,B0BWTNSKXT,Active
129-N.b.f Fashion,IM284176Baby Girls Rani Pink Frock 12-18 M,Baby Girls Rani Pink Frock 12-18 M,Amazon,Baby Girls Rani Pink Frock 12-18 M,B0FN43XQQ5,Active
129-N.b.f Fashion,IM186028Mens Red_Blue Patte Sherwani- S,Mens Red_Blue Patte Sherwani- S,Amazon,Mens Red_Blue Patte Sherwani- S,B0DD7GDLCD,Active
129-N.b.f Fashion,IM036334Mens Sky Embro Kurta-S,Mens Sky Embro Kurta-S,Amazon,Mens Sky Embro Kurta-S,B0CD2LRWKZ,Active
129-N.b.f Fashion,IM314563Girls Wine S-S Choli 3-4 Y,Girls Wine S-S Choli 3-4 Y,Amazon,Girls Wine S-S Choli 3-4 Y,B0G5F8VP44,Active
129-N.b.f Fashion,IM036848Men Cream New Jq Indo - XXL,Men Cream New Jq Indo - XXL,Amazon,Men Cream New Jq Indo - XXL,B0CR1FQGZF,Active
129-N.b.f Fashion,IM035000Mens Black Dayable Indo - XL,Mens Black Dayable Indo - XL,Amazon,Mens Black Dayable Indo - XL,B0CR485812,Active
129-N.b.f Fashion,IM038116mens blue indo - s,mens blue indo - s,Amazon,mens blue indo - s,B0966WRKJS,Active
129-N.b.f Fashion,IM186039A-Men Maroon Indo Set -M,A-Men Maroon Indo Set -M,Amazon,A-Men Maroon Indo Set -M,B0DD4FCS67,Active
129-N.b.f Fashion,IM037349Mens Ringni Dayable Indo - L,Mens Ringni Dayable Indo - L,Amazon,Mens Ringni Dayable Indo - L,B0CR4795SZ,Active
129-N.b.f Fashion,IM036277Mens Black Border Jeaquard Kurta-XXL,Mens Black Border Jeaquard Kurta-XXL,Amazon,Mens Black Border Jeaquard Kurta-XXL,B0CCSMPQ6H,Active
129-N.b.f Fashion,IM036881mens kohli indo - L,mens kohli indo - L,Amazon,mens kohli indo - L,B09PNRNX4T,Active
129-N.b.f Fashion,IM137556Mens Green Jodhpuri Kurta 801- L,Mens Green Jodhpuri Kurta 801- L,Amazon,Mens Green Jodhpuri Kurta 801- L,B0CXMS2K8Z,Active
129-N.b.f Fashion,IM036648Mens Royal Red Indo Western-XL,Mens Royal Red Indo Western-XL,Amazon,Mens Royal Red Indo Western-XL,B094YHNJZH,Active
129-N.b.f Fashion,IM038171Mens R.Yellow Indo Western - XL,Mens R.Yellow Indo Western - XL,Amazon,Mens R.Yellow Indo Western - XL,B09SYWY6PC,Active
129-N.b.f Fashion,IM036646Mens Royal Red Indo Western-M,Mens Royal Red Indo Western-M,Amazon,Mens Royal Red Indo Western-M,B094YFT571,Active
129-N.b.f Fashion,IM314559Girls Blue Multi Colour Choli 7-8 Y,Girls Blue Multi Colour Choli 7-8 Y,Amazon,Girls Blue Multi Colour Choli 7-8 Y,B0G5FX3JX3,Active
129-N.b.f Fashion,IM037494MEN-821-KPNJ-RED-XXL,MEN-821-KPNJ-RED-XXL,Amazon,MEN-821-KPNJ-RED-XXL,B08QMGDYVS,Active
129-N.b.f Fashion,IM037679Mens Red Jequard Sherwani-L,Mens Red Jequard Sherwani-L,Amazon,Mens Red Jequard Sherwani-L,B0CC9274JY,Active
129-N.b.f Fashion,IM036549Mens Cream Long Koti Kurta Indo -XL,Mens Cream Long Koti Kurta Indo -XL,Amazon,Mens Cream Long Koti Kurta Indo -XL,B0CR7SR5QB,Active
129-N.b.f Fashion,IM035110Mens RK Black Indo - XL,Mens RK Black Indo - XL,Amazon,Mens RK Black Indo - XL,B0C9D5B83Q,Active
129-N.b.f Fashion,IM036699N Mens Cream-gold Indo-S,N Mens Cream-gold Indo-S,Amazon,N Mens Cream-gold Indo-S,B0CBV5TYKT,Active
129-N.b.f Fashion,IM137536A Mens Blue Seq Koti Kurta Set 802- M,A Mens Blue Seq Koti Kurta Set 802- M,Amazon,A Mens Blue Seq Koti Kurta Set 802- M,B0CXPR2TD3,Active
129-N.b.f Fashion,IM314587Womens Blue Kurti Set - XXL,Womens Blue Kurti Set - XXL,Amazon,Womens Blue Kurti Set - XXL,B0G5GL9B5F,Active
129-N.b.f Fashion,IM036535Mens Black Long Koti Sherwani-XXL,Mens Black Long Koti Sherwani-XXL,Amazon,Mens Black Long Koti Sherwani-XXL,B0CFDR9FG1,Active
129-N.b.f Fashion,IM035728N Mens RK New Blue Indo - S,N Mens RK New Blue Indo - S,Amazon,N Mens RK New Blue Indo - S,B0C9DNLQZX,Active
129-N.b.f Fashion,IM037915Ranveer Red Indo - XXL,Ranveer Red Indo - XXL,Amazon,Ranveer Red Indo - XXL,B0B87GLV53,Active
129-N.b.f Fashion,IM284168Baby Girls Rani Pink Frock 6-12 M,Baby Girls Rani Pink Frock 6-12 M,Amazon,Baby Girls Rani Pink Frock 6-12 M,B0FN465WGR,Active
129-N.b.f Fashion,IM271348X- Mens Beige Dark Purple Boxer - M,X- Mens Beige Dark Purple Boxer - M,Amazon,X- Mens Beige Dark Purple Boxer - M,B0FBJVFN8X,Active
129-N.b.f Fashion,IM037945Red Ranveer singh-XL,Red Ranveer singh-XL,Amazon,Red Ranveer singh-XL,B08KTFY945,Active
129-N.b.f Fashion,IM037339Purple MIrror Work Cotton Kurta-S,Purple MIrror Work Cotton Kurta-S,Amazon,Purple MIrror Work Cotton Kurta-S,B0CBS3LRY7,Active
129-N.b.f Fashion,IM035587Mens RK New Blue Indo-S,Mens RK New Blue Indo-S,Amazon,Mens RK New Blue Indo-S,B0C93Z4WBW,Active
129-N.b.f Fashion,IM192477Mens Cream Cotton Kurta Wine Koti - M,Mens Cream Cotton Kurta Wine Koti - M,Amazon,Mens Cream Cotton Kurta Wine Koti - M,B0D459VBZD,Active
129-N.b.f Fashion,IM271363X- Mens Beige Purple Boxer - XL,X- Mens Beige Purple Boxer - XL,Amazon,X- Mens Beige Purple Boxer - XL,B0FBJGQTK7,Active
129-N.b.f Fashion,IM314578Girls Wine F-S Choli 3-4 Y,Girls Wine F-S Choli 3-4 Y,Amazon,Girls Wine F-S Choli 3-4 Y,B0G5FGK78J,Active
129-N.b.f Fashion,IM337628Mens White Koti Kurta Set - S,Mens White Koti Kurta Set - S,Amazon,Mens White Koti Kurta Set - S,B0GPDGVK3F,Active
129-N.b.f Fashion,IM037567Mens Kohli Style Red KPNJ - XL,Mens Kohli Style Red KPNJ - XL,Amazon,Mens Kohli Style Red KPNJ - XL,B09B1V79M2,Active
129-N.b.f Fashion,IM037328Mens-Cotton-Kurta-M,Mens-Cotton-Kurta-M,Amazon,Mens-Cotton-Kurta-M,B0CBMT9VW4,Active
129-N.b.f Fashion,IM035663Mens Temple Blue New Indo-S,Mens Temple Blue New Indo-S,Amazon,Mens Temple Blue New Indo-S,B0CQ2HZZ12,Active
129-N.b.f Fashion,IM036647Mens Royal Red Indo Western-S,Mens Royal Red Indo Western-S,Amazon,Mens Royal Red Indo Western-S,B094YJDDDP,Active
129-N.b.f Fashion,IM036526Mens (A) SKY New Side Indo-S,Mens (A) SKY New Side Indo-S,Amazon,Mens (A) SKY New Side Indo-S,B0CR77ZTPT,Active
129-N.b.f Fashion,IM037598Mens Light-Red Jequard Sherwani-XXL,Mens Light-Red Jequard Sherwani-XXL,Amazon,Mens Light-Red Jequard Sherwani-XXL,B0CC8VVKLW,Active
129-N.b.f Fashion,IM037575Mens Lakhanvi Red Kurta Set - M,Mens Lakhanvi Red Kurta Set - M,Amazon,Mens Lakhanvi Red Kurta Set - M,B0B84RKPK7,Active
129-N.b.f Fashion,IM035680Mens-20821-New Red-XXL,Mens-20821-New Red-XXL,Amazon,Mens-20821-New Red-XXL,B08RBYKCGM,Active
129-N.b.f Fashion,IM037304Mens Dayable Purrple Indo - S,Mens Dayable Purrple Indo - S,Amazon,Mens Dayable Purrple Indo - S,B0CR49NC6S,Active
129-N.b.f Fashion,IM035874N Mens Brown Indo-XL,N Mens Brown Indo-XL,Amazon,N Mens Brown Indo-XL,B0CBVJF4TY,Active
129-N.b.f Fashion,IM036704N Mens Cream-Red Indo-S,N Mens Cream-Red Indo-S,Amazon,N Mens Cream-Red Indo-S,B0CBVH6PWG,Active
129-N.b.f Fashion,IM271373X- Mens Black Checked Boxer - S,X- Mens Black Checked Boxer - S,Amazon,X- Mens Black Checked Boxer - S,B0FBJSWLRZ,Active
129-N.b.f Fashion,IM036720N Multi Silver Indo For Mens-M,N Multi Silver Indo For Mens-M,Amazon,N Multi Silver Indo For Mens-M,B0BXH6YHWN,Active
129-N.b.f Fashion,IM0360184K-H28L-SKL7,4K-H28L-SKL7,Amazon,4K-H28L-SKL7,B0CBPGDLGD,Active
129-N.b.f Fashion,IM037257N Mens dark-pink Embro Kurta-XL,N Mens dark-pink Embro Kurta-XL,Amazon,N Mens dark-pink Embro Kurta-XL,B0CD2M6V7X,Active
129-N.b.f Fashion,IM037929Red Indo For Mens -M,Red Indo For Mens -M,Amazon,Red Indo For Mens -M,B0BX3Y6J2R,Active
129-N.b.f Fashion,IM038168Mens R.Yellow Indo Western - L,Mens R.Yellow Indo Western - L,Amazon,Mens R.Yellow Indo Western - L,B09SYXFT6K,Active
129-N.b.f Fashion,IM036494Men KTPJNJ 20200821-RD-GJ -L,Men KTPJNJ 20200821-RD-GJ -L,Amazon,Men KTPJNJ 20200821-RD-GJ -L,B08GQ356V6,Active
129-N.b.f Fashion,IM038307Mens Yellow Ranveer Indo West -  L,Mens Yellow Ranveer Indo West -  L,Amazon,Mens Yellow Ranveer Indo West -  L,B09Y1JJ13Z,Active
129-N.b.f Fashion,IM035558Mens RK Blue Fancy Indo - XL,Mens RK Blue Fancy Indo - XL,Amazon,Mens RK Blue Fancy Indo - XL,B0C789FV82,Active
129-N.b.f Fashion,IM271412X- Mens Beige Boxer - L,X- Mens Beige Boxer - L,Amazon,X- Mens Beige Boxer - L,B0FBJT9G7T,Active
129-N.b.f Fashion,IM035112Mens RK Black Indo Dhoti Set - L,Mens RK Black Indo Dhoti Set - L,Amazon,Mens RK Black Indo Dhoti Set - L,B0C9D58F4N,Active
129-N.b.f Fashion,IM036541Mens Black-Border Indo-S,Mens Black-Border Indo-S,Amazon,Mens Black-Border Indo-S,B0CBVGSD71,Active
129-N.b.f Fashion,IM036929Mens Kohli Cream Red Indo-XXL,Mens Kohli Cream Red Indo-XXL,Amazon,Mens Kohli Cream Red Indo-XXL,B0CD28LN9D,Active
129-N.b.f Fashion,IM038037Mens-2021-KTPJ-Plain White-L,Mens-2021-KTPJ-Plain White-L,Amazon,Mens-2021-KTPJ-Plain White-L,B09C6FSQX8,Active
129-N.b.f Fashion,IM337622Mens Black Rani Indo Set - S,Mens Black Rani Indo Set - S,Amazon,Mens Black Rani Indo Set - S,B0GPD13NJ3,Active
129-N.b.f Fashion,IM035006Mens Black Dayable Indo Set - XL,Mens Black Dayable Indo Set - XL,Amazon,Mens Black Dayable Indo Set - XL,B0CR95QLLR,Active
129-N.b.f Fashion,IM314575Girls Baby Pink Top Bottom 4-5 Y,Girls Baby Pink Top Bottom 4-5 Y,Amazon,Girls Baby Pink Top Bottom 4-5 Y,B0FTMHFTLL,Active
129-N.b.f Fashion,IM036242Mens Pista Embro Kurta - L,Mens Pista Embro Kurta - L,Amazon,Mens Pista Embro Kurta - L,B0BWTXK5NC,Active
129-N.b.f Fashion,IM314540Girls Wine S-S Choli 9-10 Y,Girls Wine S-S Choli 9-10 Y,Amazon,Girls Wine S-S Choli 9-10 Y,B0G5GFW62F,Active
129-N.b.f Fashion,IM284149Baby Girls Grey Frock 5-6 Y,Baby Girls Grey Frock 5-6 Y,Amazon,Baby Girls Grey Frock 5-6 Y,B0FN43QVM5,Active
129-N.b.f Fashion,IM314503Girls White Top Bottom 6-7 Y,Girls White Top Bottom 6-7 Y,Amazon,Girls White Top Bottom 6-7 Y,B0FTMKPH5D,Active
129-N.b.f Fashion,IM036884Mens Kohli Indo - XL,Mens Kohli Indo - XL,Amazon,Mens Kohli Indo - XL,B0BQCBRNH4,Active
129-N.b.f Fashion,IM037124Mens Dark-Pink Embro Kurta-XXL,Mens Dark-Pink Embro Kurta-XXL,Amazon,Mens Dark-Pink Embro Kurta-XXL,B0CD2L8WKY,Active
129-N.b.f Fashion,IM284249A-Men Pista Koti Kurta_S,A-Men Pista Koti Kurta_S,Amazon,A-Men Pista Koti Kurta_S,B0FM7YP8QW,Active
129-N.b.f Fashion,IM036525Mens (A) SKY New Side Indo-M,Mens (A) SKY New Side Indo-M,Amazon,Mens (A) SKY New Side Indo-M,B0CR7JZC1L,Active
129-N.b.f Fashion,IM035572Mens Rk Light Blue Indo - S,Mens Rk Light Blue Indo - S,Amazon,Mens Rk Light Blue Indo - S,B0C9D4P8YM,Active
129-N.b.f Fashion,IM314589Womens Yellow Kurti Set - S,Womens Yellow Kurti Set - S,Amazon,Womens Yellow Kurti Set - S,B0G5G68CJ5,Active
129-N.b.f Fashion,IM037103Mens Dark Pink Emb Lakhanvi Kurta - S,Mens Dark Pink Emb Lakhanvi Kurta - S,Amazon,Mens Dark Pink Emb Lakhanvi Kurta - S,B0BWRNFJL5,Active
129-N.b.f Fashion,IM037599Mens Long  Red Koti kurta Set - L,Mens Long  Red Koti kurta Set - L,Amazon,Mens Long  Red Koti kurta Set - L,B0CR1HJZ3Z,Active
129-N.b.f Fashion,IM036787NavyBlue-White Embro Kurta-L,NavyBlue-White Embro Kurta-L,Amazon,NavyBlue-White Embro Kurta-L,B0B6RQFFC6,Active
129-N.b.f Fashion,IM037646Mens Red Embro Kurta Set  - XXL,Mens Red Embro Kurta Set  - XXL,Amazon,Mens Red Embro Kurta Set - XXL,B0B865KKZY,Active
129-N.b.f Fashion,IM037675Mens Red Jeaquard Indo-M,Mens Red Jeaquard Indo-M,Amazon,Mens Red Jeaquard Indo-M,B0CC8VS2SN,Active
129-N.b.f Fashion,IM186011Mens Maroon Satin Pattern Indo - S,Mens Maroon Satin Pattern Indo - S,Amazon,Mens Maroon Satin Pattern Indo - S,B0DCZTTWVS,Active
129-N.b.f Fashion,IM036536Mens BlackBorder Indo-L,Mens BlackBorder Indo-L,Amazon,Mens BlackBorder Indo-L,B0CBVJ27GS,Active
129-N.b.f Fashion,IM038152Mens Long Yellow Koti kurta Set - XXL,Mens Long Yellow Koti kurta Set - XXL,Amazon,Mens Long Yellow Koti kurta Set - XXL,B0CR1GPX3K,Active
129-N.b.f Fashion,IM035462Mens Blue Silver Shade Indo West- M,Mens Blue Silver Shade Indo West- M,Amazon,Mens Blue Silver Shade Indo West- M,B097N3KTRG,Active
129-N.b.f Fashion,IM271389Baby Girls Maroon Frock 4-5 Y,Baby Girls Maroon Frock 4-5 Y,Amazon,Baby Girls Maroon Frock 4-5 Y,B0F91Q388M,Active
129-N.b.f Fashion,IM036780Navy Blue-White Embro Kurta Set-S,Navy Blue-White Embro Kurta Set-S,Amazon,Navy Blue-White Embro Kurta Set-S,B0B6VX9DZN,Active
129-N.b.f Fashion,IM036724N Ranveer Red Koti - XL,N Ranveer Red Koti - XL,Amazon,N Ranveer Red Koti - XL,B09TJCFKSQ,Active
129-N.b.f Fashion,IM271410X- Mens Green Lining  Boxer - L,X- Mens Green Lining  Boxer - L,Amazon,X- Mens Green Lining  Boxer - L,B0FBJKMZYP,Active
129-N.b.f Fashion,IM284190A- Baby Girls Maroon Frock 5-6 Y,A- Baby Girls Maroon Frock 5-6 Y,Amazon,A- Baby Girls Maroon Frock 5-6 Y,B0FN468LC1,Active
129-N.b.f Fashion,IM035583Mens RK New Blue Indo - XL,Mens RK New Blue Indo - XL,Amazon,Mens RK New Blue Indo - XL,B0C72FL7YC,Active
129-N.b.f Fashion,IM322448Womens Cream Printed Kurti Set - M,Womens Cream Printed Kurti Set - M,Amazon,Womens Cream Printed Kurti Set - M,B0G6ZGXQ3K,Active
129-N.b.f Fashion,IM284205Mens Black Indo_S,Mens Black Indo_S,Amazon,Mens Black Indo_S,B0FM83MXP4,Active
129-N.b.f Fashion,IM037254N Mens dark-pink Embro Kurta-L,N Mens dark-pink Embro Kurta-L,Amazon,N Mens dark-pink Embro Kurta-L,B0CD2LG1HC,Active
129-N.b.f Fashion,IM038318Mens Yellow Ranveer Indo-M,Mens Yellow Ranveer Indo-M,Amazon,Mens Yellow Ranveer Indo-M,B09CDTQGHY,Active
129-N.b.f Fashion,IM038149Mens Long Yellow Koti kurta Set - M,Mens Long Yellow Koti kurta Set - M,Amazon,Mens Long Yellow Koti kurta Set - M,B0CR1DLH2M,Active
129-N.b.f Fashion,IM284211A-Mens Kohli Indo_XL,A-Mens Kohli Indo_XL,Amazon,A-Mens Kohli Indo_XL,B0FM85H6L7,Active
129-N.b.f Fashion,IM036220Viscose Chikankari Kurta Green-XXL,Viscose Chikankari Kurta Green-XXL,Amazon,Viscose Chikankari Kurta Green-XXL,B0CBTTXNWZ,Active
129-N.b.f Fashion,IM337620Mens White Koti Kurta Set - L,Mens White Koti Kurta Set - L,Amazon,Mens White Koti Kurta Set - L,B0GPDCCGSB,Active
129-N.b.f Fashion,IM036273Mens Black Border Jeaquard Kurta-L,Mens Black Border Jeaquard Kurta-L,Amazon,Mens Black Border Jeaquard Kurta-L,B0CCSPN5DP,Active
129-N.b.f Fashion,IM037334Purple Mirrir Work Kurta-S,Purple Mirrir Work Kurta-S,Amazon,Purple Mirrir Work Kurta-S,B0CBS4M89L,Active
129-N.b.f Fashion,IM035884Kohli Mens Indo-M,Kohli Mens Indo-M,Amazon,Kohli Mens Indo-M,B0CD2BYYDJ,Active
129-N.b.f Fashion,IM192472Mens-120 Black Red Indo Set - XXL,Mens-120 Black Red Indo Set - XXL,Amazon,Mens-120 Black Red Indo Set - XXL,B0D2NW8SGC,Active
129-N.b.f Fashion,IM035569Mens RK Dark Blue Indo - XXL,Mens RK Dark Blue Indo - XXL,Amazon,Mens RK Dark Blue Indo - XXL,B0CPYFSGHF,Active
129-N.b.f Fashion,IM036711N Mens R.Red Indo - M,N Mens R.Red Indo - M,Amazon,N Mens R.Red Indo - M,B09CMSCVN1,Active
129-N.b.f Fashion,IM322453Womens Cream Printed Kurti Set - L,Womens Cream Printed Kurti Set - L,Amazon,Womens Cream Printed Kurti Set - L,B0G6ZP4PJQ,Active
129-N.b.f Fashion,IM271417X- Mens Beige Red Linig  Boxer - XXL,X- Mens Beige Red Linig  Boxer - XXL,Amazon,X- Mens Beige Red Linig  Boxer - XXL,B0FBJXC6X4,Active
129-N.b.f Fashion,IM037514Mens (A) Red Long Koti Kurta Set-XXL,Mens (A) Red Long Koti Kurta Set-XXL,Amazon,Mens (A) Red Long Koti Kurta Set-XXL,B0CR93RQL6,Active
129-N.b.f Fashion,IM034952Black MIrror Work Cotton Kurta-S,Black MIrror Work Cotton Kurta-S,Amazon,Black MIrror Work Cotton Kurta-S,B0CBS6QP88,Active
129-N.b.f Fashion,IM036428Mens RK Mahendi Indo - XL,Mens RK Mahendi Indo - XL,Amazon,Mens RK Mahendi Indo - XL,B0C942MFYW,Active
129-N.b.f Fashion,IM271383X- Mens Black Checked Boxer - XL,X- Mens Black Checked Boxer - XL,Amazon,X- Mens Black Checked Boxer - XL,B0FBJYZ7SP,Active
129-N.b.f Fashion,IM036625Mens Ranveer Singh Indo Western -M,Mens Ranveer Singh Indo Western -M,Amazon,Mens Ranveer Singh Indo Western -M,B094WF9BZC,Active
129-N.b.f Fashion,IM271388X- Mens Black Linig Boxer - XL,X- Mens Black Linig Boxer - XL,Amazon,X- Mens Black Linig Boxer - XL,B0FBK35T9J,Active
129-N.b.f Fashion,IM314550Girls Green Top Bottom 6-7 Y,Girls Green Top Bottom 6-7 Y,Amazon,Girls Green Top Bottom 6-7 Y,B0FTML5KWQ,Active
129-N.b.f Fashion,IM036768Man Maroon-White Embro Kurta-S,Man Maroon-White Embro Kurta-S,Amazon,Man Maroon-White Embro Kurta-S,B0B6TXRCCW,Active
129-N.b.f Fashion,IM036412Mens Maroon MKPNJ- S,Mens Maroon MKPNJ- S,Amazon,Mens Maroon MKPNJ- S,B08KNKRN3G,Active
129-N.b.f Fashion,IM036353Mens Sky Lakhanvi Kurta Set - M,Mens Sky Lakhanvi Kurta Set - M,Amazon,Mens Sky Lakhanvi Kurta Set - M,B0BWS1XJMB,Active
129-N.b.f Fashion,IM036811Mens Multi Colour Silver  Indo - XXL,Mens Multi Colour Silver  Indo - XXL,Amazon,Mens Multi Colour Silver Indo - XXL,B09CDWPH9D,Active
129-N.b.f Fashion,IM322432A- Girls Black Choli 3-4 Y,A- Girls Black Choli 3-4 Y,Amazon,A- Girls Black Choli 3-4 Y,B0G5Z5FB8T,Active
129-N.b.f Fashion,IM038288Mens Yellow Old Lakhanvi Kurta - XXL,Mens Yellow Old Lakhanvi Kurta - XXL,Amazon,Mens Yellow Old Lakhanvi Kurta - XXL,B0C5THTD6C,Active
129-N.b.f Fashion,IM038150Mens Long Yellow Koti kurta Set - S,Mens Long Yellow Koti kurta Set - S,Amazon,Mens Long Yellow Koti kurta Set - S,B0CR1F6CV7,Active
