Vendor Code,Master SKU,SKU,Channel,Channel SKU,Identifier,Status (Active / Inactive)
129-N.b.f Fashion,IM186021Mens Rama Indo Western Set - S,Mens Rama Indo Western Set - S,Amazon,Mens Rama Indo Western Set - S,B0DCZG93ZT,Active
129-N.b.f Fashion,IM037676Mens Red Jeaquard Indo-S,Mens Red Jeaquard Indo-S,Amazon,Mens Red Jeaquard Indo-S,B0CC8W2HQ8,Active
129-N.b.f Fashion,IM337630Mens Grey Koti Kurta Set - L,Mens Grey Koti Kurta Set - L,Amazon,Mens Grey Koti Kurta Set - L,B0GPDKSDD1,Active
129-N.b.f Fashion,IM035454Mens Blue Silver Indo - XL,Mens Blue Silver Indo - XL,Amazon,Mens Blue Silver Indo - XL,B0B84Z2LNH,Active
129-N.b.f Fashion,IM314570Girls SKY Printed Frock 12-18 M,Girls SKY Printed Frock 12-18 M,Amazon,Girls SKY Printed Frock 12-18 M,B0G5GNF6TP,Active
129-N.b.f Fashion,IM037955Red Waistcoats  -XXL,Red Waistcoats -XXL,Amazon,Red Waistcoats -XXL,B08PZHBHQZ,Active
129-N.b.f Fashion,IM036603Mens Old Perrot Indo Set - M,Mens Old Perrot Indo Set - M,Amazon,Mens Old Perrot Indo Set - M,B0CR1KNTZQ,Active
129-N.b.f Fashion,IM137552Mens A- Blue Seq Indo - M,Mens A- Blue Seq Indo - M,Amazon,Mens A- Blue Seq Indo - M,B0CXPLCQV6,Active
129-N.b.f Fashion,IM037563Mens Kohli Style Red KPNJ  - XXL,Mens Kohli Style Red KPNJ  - XXL,Amazon,Mens Kohli Style Red KPNJ - XXL,B09B1T8953,Active
129-N.b.f Fashion,IM037289Mens Dark Purple Indo Set -M,Mens Dark Purple Indo Set -M,Amazon,Mens Dark Purple Indo Set -M,B0CR46VK3T,Active
129-N.b.f Fashion,IM035132Mens-Mirror-Kurta-S,Mens-Mirror-Kurta-S,Amazon,Mens-Mirror-Kurta-S,B0CBMLVT46,Active
129-N.b.f Fashion,IM037626mens ranveer yellow indo = m,mens ranveer yellow indo = m,Amazon,mens ranveer yellow indo = m,B09814MJL1,Active
129-N.b.f Fashion,IM036131Mens Mahendi Indo Western-M,Mens Mahendi Indo Western-M,Amazon,Mens Mahendi Indo Western-M,B0966BSGW3,Active
129-N.b.f Fashion,IM284210A-Mens Kohli Indo_M,A-Mens Kohli Indo_M,Amazon,A-Mens Kohli Indo_M,B0FM81CTWF,Active
129-N.b.f Fashion,IM035105mens ranveer yellow indo - s,mens ranveer yellow indo - s,Amazon,mens ranveer yellow indo - s,B09816P9XF,Active
129-N.b.f Fashion,IM036626Mens Ranveer Singh Indo Western -S,Mens Ranveer Singh Indo Western -S,Amazon,Mens Ranveer Singh Indo Western -S,B094WC69KT,Active
129-N.b.f Fashion,IM036705N Mens Cream-Red Indo-XL,N Mens Cream-Red Indo-XL,Amazon,N Mens Cream-Red Indo-XL,B0CBVJRX1W,Active
129-N.b.f Fashion,IM284182A- Baby Girls Red Frock 3-4 Y,A- Baby Girls Red Frock 3-4 Y,Amazon,A- Baby Girls Red Frock 3-4 Y,B0FN44DTJP,Active
129-N.b.f Fashion,IM038158Mens R.Yellow  Indo - L,Mens R.Yellow  Indo - L,Amazon,Mens R.Yellow  Indo - L,B09SYTLX5Q,Active
129-N.b.f Fashion,IM037767Mens RK Red Indo - L,Mens RK Red Indo - L,Amazon,Mens RK Red Indo - L,B0C9GVMQFJ,Active
129-N.b.f Fashion,IM284227X-Mens Black Long Koti Sherwani-S_new,X-Mens Black Long Koti Sherwani-S_new,Amazon,X-Mens Black Long Koti Sherwani-S_new,B0FM7PG4PR,Active
129-N.b.f Fashion,IM037918Ranveer Red Koti - S,Ranveer Red Koti - S,Amazon,Ranveer Red Koti - S,B09SWWJ4FL,Active
129-N.b.f Fashion,IM036650Mens Silver Multi Colour Indo - L,Mens Silver Multi Colour Indo - L,Amazon,Mens Silver Multi Colour Indo - L,B097N55LRJ,Active
129-N.b.f Fashion,IM036415Mens Marron Embro Kurta - L,Mens Marron Embro Kurta - L,Amazon,Mens Marron Embro Kurta - L,B0BWTXVYLG,Active
129-N.b.f Fashion,IM035274Mens (A) Blue Long Koti Kurta Indo-M,Mens (A) Blue Long Koti Kurta Indo-M,Amazon,Mens (A) Blue Long Koti Kurta Indo-M,B0CR7RNXBH,Active
129-N.b.f Fashion,IM192427Mens 124 Black Blue Indo - XXL,Mens 124 Black Blue Indo - XXL,Amazon,Mens 124 Black Blue Indo - XXL,B0D2NRL8HC,Active
129-N.b.f Fashion,IM035456Mens Blue Silver Indo Western - L,Mens Blue Silver Indo Western - L,Amazon,Mens Blue Silver Indo Western - L,B09BNQYVWY,Active
129-N.b.f Fashion,IM314522Girls Perot  Top Bottom 2-3 Y,Girls Perot  Top Bottom 2-3 Y,Amazon,Girls Perot  Top Bottom 2-3 Y,B0FTMKBBKK,Active
129-N.b.f Fashion,IM322437Womens Sky Printed Kurti Set - S,Womens Sky Printed Kurti Set - S,Amazon,Womens Sky Printed Kurti Set - S,B0G6ZWRPP2,Active
129-N.b.f Fashion,IM037174Mens Pink  Jq New Indo - XL,Mens Pink  Jq New Indo - XL,Amazon,Mens Pink  Jq New Indo - XL,B0CQ25FC3R,Active
129-N.b.f Fashion,IM137515Mens A- Red Seq Indo - L,Mens A- Red Seq Indo - L,Amazon,Mens A- Red Seq Indo - L,B0CXPJZYHQ,Active
129-N.b.f Fashion,IM211646Mens Black-Yellow Long Koti Kurta - XXL,Mens Black-Yellow Long Koti Kurta - XXL,Amazon,Mens Black-Yellow Long Koti Kurta - XXL,B0DR6T3MJP,Active
129-N.b.f Fashion,IM035455Mens Blue Silver Indo - XXL,Mens Blue Silver Indo - XXL,Amazon,Mens Blue Silver Indo - XXL,B0B84VPVX3,Active
129-N.b.f Fashion,IM322443A- Girls Blue Choli 7-8 Y,A- Girls Blue Choli 7-8 Y,Amazon,A- Girls Blue Choli 7-8 Y,B0G9LXMYHF,Active
129-N.b.f Fashion,IM036419Mens Marron Embro Kurta -XXL,Mens Marron Embro Kurta -XXL,Amazon,Mens Marron Embro Kurta -XXL,B0BWTVPXS4,Active
129-N.b.f Fashion,IM037606Mens R.Red Indo - M,Mens R.Red Indo - M,Amazon,Mens R.Red Indo - M,B09SYW5H6F,Active
129-N.b.f Fashion,IM036651Mens Silver Multi Colour Indo - S,Mens Silver Multi Colour Indo - S,Amazon,Mens Silver Multi Colour Indo - S,B097N573BR,Active
129-N.b.f Fashion,IM037972SW-UW7J-IOA9,SW-UW7J-IOA9,Amazon,SW-UW7J-IOA9,B0CBPF5SLN,Active
129-N.b.f Fashion,IM035270Mens (A) Blue Flower Indo Set - S,Mens (A) Blue Flower Indo Set - S,Amazon,Mens (A) Blue Flower Indo Set - S,B0CR7RGTV4,Active
129-N.b.f Fashion,IM035585Mens RK New Blue Indo-L,Mens RK New Blue Indo-L,Amazon,Mens RK New Blue Indo-L,B0C943V9BH,Active
129-N.b.f Fashion,IM037511Mens (A) Red Long Koti Kurta Set-M,Mens (A) Red Long Koti Kurta Set-M,Amazon,Mens (A) Red Long Koti Kurta Set-M,B0CR9384H8,Active
129-N.b.f Fashion,IM137519Mens A- Red Seq Indo - S,Mens A- Red Seq Indo - S,Amazon,Mens A- Red Seq Indo - S,B0CXPG9ZPH,Active
129-N.b.f Fashion,IM037615Mens Ranveer Koti - L,Mens Ranveer Koti - L,Amazon,Mens Ranveer Koti - L,B09Y8SX9L3,Active
129-N.b.f Fashion,IM271402Mens Light Yellow  Seq Kurta Set - XXL,Mens Light Yellow  Seq Kurta Set - XXL,Amazon,Mens Light Yellow  Seq Kurta Set - XXL,B0F9X8TS3H,Active
129-N.b.f Fashion,IM037539Mens Dark Red Indo Western-XXL,Mens Dark Red Indo Western-XXL,Amazon,Mens Dark Red Indo Western-XXL,B08Y91MZHV,Active
129-N.b.f Fashion,IM038227Mens Yellow Jq New Indo -XXL,Mens Yellow Jq New Indo -XXL,Amazon,Mens Yellow Jq New Indo -XXL,B0CQ22XYPX,Active
129-N.b.f Fashion,IM037362821-NEW-NJ-XL,821-NEW-NJ-XL,Amazon,821-NEW-NJ-XL,B08QN5L3NS,Active
129-N.b.f Fashion,IM037506Mens  Red Ranveer Indo-M,Mens  Red Ranveer Indo-M,Amazon,Mens  Red Ranveer Indo-M,B09CDVVC8V,Active
129-N.b.f Fashion,IM186394Mens Black Koti Kurta Set -S,Mens Black Koti Kurta Set -S,Amazon,Mens Black Koti Kurta Set -S,B0DCGBJR86,Active
129-N.b.f Fashion,IM036596Mens Multicolour Indowesten-M,Mens Multicolour Indowesten-M,Amazon,Mens Multicolour Indowesten-M,B0951QSYT3,Active
129-N.b.f Fashion,IM192430Mens Cream Cotton Kurta Wine Koti - XL,Mens Cream Cotton Kurta Wine Koti - XL,Amazon,Mens Cream Cotton Kurta Wine Koti - XL,B0D44JPTX9,Active
129-N.b.f Fashion,IM036561Mens Cream-Gold Indo-XXL,Mens Cream-Gold Indo-XXL,Amazon,Mens Cream-Gold Indo-XXL,B0CBWRXFHJ,Active
129-N.b.f Fashion,IM037853N Mens Red Indo-XXL,N Mens Red Indo-XXL,Amazon,N Mens Red Indo-XXL,B0CBVKT9TH,Active
129-N.b.f Fashion,IM137539A - Mens Black Seq Long Koti Kurta - M,A - Mens Black Seq Long Koti Kurta - M,Amazon,A - Mens Black Seq Long Koti Kurta - M,B0CXPNFNN8,Active
129-N.b.f Fashion,IM035461Mens Blue Silver Shade Indo -S,Mens Blue Silver Shade Indo -S,Amazon,Mens Blue Silver Shade Indo -S,B09CDVHBZL,Active
129-N.b.f Fashion,IM036544Mens Black-Border Indo-XXL,Mens Black-Border Indo-XXL,Amazon,Mens Black-Border Indo-XXL,B0CBWSPR7F,Active
129-N.b.f Fashion,IM192421Mens-120 Black Red Indo Set - M,Mens-120 Black Red Indo Set - M,Amazon,Mens-120 Black Red Indo Set - M,B0D2NVY6QB,Active
129-N.b.f Fashion,IM037619Mens Ranveer Koti - XXL,Mens Ranveer Koti - XXL,Amazon,Mens Ranveer Koti - XXL,B09Y8T86C2,Active
129-N.b.f Fashion,IM037538Mens Dark Red Indo Western-XL,Mens Dark Red Indo Western-XL,Amazon,Mens Dark Red Indo Western-XL,B08Y919HCN,Active
129-N.b.f Fashion,IM036731ranveer red indo - L,ranveer red indo - L,Amazon,ranveer red indo - L,B099RLQ56B,Active
129-N.b.f Fashion,IM036560Mens Cream-Gold Indo-XL,Mens Cream-Gold Indo-XL,Amazon,Mens Cream-Gold Indo-XL,B0CBWQN9ZQ,Active
129-N.b.f Fashion,IM035662Mens Temple Blue New Indo-M,Mens Temple Blue New Indo-M,Amazon,Mens Temple Blue New Indo-M,B0CQ2CTMRP,Active
129-N.b.f Fashion,IM038108Men Yellow Ranveer Indo- XL,Men Yellow Ranveer Indo- XL,Amazon,Men Yellow Ranveer Indo- XL,B0BYVRJDSK,Active
129-N.b.f Fashion,IM314583Girls Blue Multi Colour Choli 18-24 M,Girls Blue Multi Colour Choli 18-24 M,Amazon,Girls Blue Multi Colour Choli 18-24 M,B0G5FKR66Q,Active
129-N.b.f Fashion,IM037323Mens-cotton MirrorKurta-M,Mens-cotton MirrorKurta-M,Amazon,Mens-cotton MirrorKurta-M,B0CBMNR4G6,Active
129-N.b.f Fashion,IM035544Mens R@nveer Royal Red Indo - XXL,Mens R@nveer Royal Red Indo - XXL,Amazon,Mens R@nveer Royal Red Indo - XXL,B099RKZNG5,Active
129-N.b.f Fashion,IM271391X- Mens grey Boxer - XXL,X- Mens grey Boxer - XXL,Amazon,X- Mens grey Boxer - XXL,B0FBK3G6YN,Active
129-N.b.f Fashion,IM037325Mens-cotton MirrorKurta-XL,Mens-cotton MirrorKurta-XL,Amazon,Mens-cotton MirrorKurta-XL,B0CBMNXWBK,Active
129-N.b.f Fashion,IM037256N Mens dark-pink Embro Kurta-S,N Mens dark-pink Embro Kurta-S,Amazon,N Mens dark-pink Embro Kurta-S,B0CD2J1YW5,Active
129-N.b.f Fashion,IM314594Girls SKY Printed Frock 3-4,Girls SKY Printed Frock 3-4,Amazon,Girls SKY Printed Frock 3-4,B0G5G47HCW,Active
129-N.b.f Fashion,IM035883Kohli Mens Indo-L,Kohli Mens Indo-L,Amazon,Kohli Mens Indo-L,B0CD29FHBX,Active
129-N.b.f Fashion,IM271351X- Mens Green Lining  Boxer - M,X- Mens Green Lining  Boxer - M,Amazon,X- Mens Green Lining  Boxer - M,B0FBKB5M7V,Active
129-N.b.f Fashion,IM036729Ranveer Koti - S,Ranveer Koti - S,Amazon,Ranveer Koti - S,B094GRPKFG,Active
129-N.b.f Fashion,IM271362Mens Lime Green Seq Kurta Set - L,Mens Lime Green Seq Kurta Set - L,Amazon,Mens Lime Green Seq Kurta Set - L,B0F9X7Q7YG,Active
129-N.b.f Fashion,IM035668Mens Yellow JQ Ranveer Indo-XL,Mens Yellow JQ Ranveer Indo-XL,Amazon,Mens Yellow JQ Ranveer Indo-XL,B0BXH5L1YH,Active
129-N.b.f Fashion,IM035687N Mens Blue Indo - S,N Mens Blue Indo - S,Amazon,N Mens Blue Indo - S,B097HNR3QV,Active
129-N.b.f Fashion,IM034976Men Black Gold Indo Set - M,Men Black Gold Indo Set - M,Amazon,Men Black Gold Indo Set - M,B0CR94Q9BD,Active
129-N.b.f Fashion,IM035580Mens RK New Blue Indo - L,Mens RK New Blue Indo - L,Amazon,Mens RK New Blue Indo - L,B0C72DSK7V,Active
129-N.b.f Fashion,IM037344Mens Dayable Wine Indo - L,Mens Dayable Wine Indo - L,Amazon,Mens Dayable Wine Indo - L,B0CR48VKRM,Active
129-N.b.f Fashion,IM034948Black long Koti Kurta-XL,Black long Koti Kurta-XL,Amazon,Black long Koti Kurta-XL,B0CCRX553K,Active
129-N.b.f Fashion,IM035579Mens RK Light Blue Indo-XXL,Mens RK Light Blue Indo-XXL,Amazon,Mens RK Light Blue Indo-XXL,B0C9467V9F,Active
129-N.b.f Fashion,IM284158Baby Girls Grey Frock 6-12 M,Baby Girls Grey Frock 6-12 M,Amazon,Baby Girls Grey Frock 6-12 M,B0FN47CJZF,Active
129-N.b.f Fashion,IM037535Mens Dark Red Indo Western-L,Mens Dark Red Indo Western-L,Amazon,Mens Dark Red Indo Western-L,B08Y8YDGLJ,Active
129-N.b.f Fashion,IM037255N Mens dark-pink Embro Kurta-M,N Mens dark-pink Embro Kurta-M,Amazon,N Mens dark-pink Embro Kurta-M,B0CD2J8WT3,Active
129-N.b.f Fashion,IM035724N mens kohli indo - xl,N mens kohli indo - xl,Amazon,N mens kohli indo - xl,B09PNRVQ3H,Active
129-N.b.f Fashion,IM284160A- Baby Girls Pink Frock 18-24 M,A- Baby Girls Pink Frock 18-24 M,Amazon,A- Baby Girls Pink Frock 18-24 M,B0FN43LL92,Active
129-N.b.f Fashion,IM035003Mens Black Dayable Indo Set - L,Mens Black Dayable Indo Set - L,Amazon,Mens Black Dayable Indo Set - L,B0CR9568XK,Active
129-N.b.f Fashion,IM035906Mens Gold Flower Indo West-XL,Mens Gold Flower Indo West-XL,Amazon,Mens Gold Flower Indo West-XL,B0968THVVS,Active
129-N.b.f Fashion,IM035140N Black long Koti Kurta-XL,N Black long Koti Kurta-XL,Amazon,N Black long Koti Kurta-XL,B0CCRNSB3R,Active
129-N.b.f Fashion,IM284247A-Men Pista Koti Kurta_XL,A-Men Pista Koti Kurta_XL,Amazon,A-Men Pista Koti Kurta_XL,B0FM82HSVT,Active
129-N.b.f Fashion,IM186310Mens New Blue Red Indo Set - XL,Mens New Blue Red Indo Set - XL,Amazon,Mens New Blue Red Indo Set - XL,B0D9DGVJGS,Active
129-N.b.f Fashion,IM035588Mens RK New Blue Indo-XL,Mens RK New Blue Indo-XL,Amazon,Mens RK New Blue Indo-XL,B0C9465S4S,Active
129-N.b.f Fashion,IM035083Mens Dayable Black Indo - XL,Mens Dayable Black Indo - XL,Amazon,Mens Dayable Black Indo - XL,B0CR4CJHB9,Active
129-N.b.f Fashion,IM035010Mens Black Gold Indo Set - M,Mens Black Gold Indo Set - M,Amazon,Mens Black Gold Indo Set - M,B0CR1J91RG,Active
129-N.b.f Fashion,IM036784Navyblue-white Embro Kurta Set-M,Navyblue-white Embro Kurta Set-M,Amazon,Navyblue-white Embro Kurta Set-M,B0B6VB3NP9,Active
129-N.b.f Fashion,IM271350X- Mens Beige Red Linig  Boxer - M,X- Mens Beige Red Linig  Boxer - M,Amazon,X- Mens Beige Red Linig  Boxer - M,B0FBK7DKB2,Active
129-N.b.f Fashion,IM034950Black MIrror Work Cotton Kurta-L,Black MIrror Work Cotton Kurta-L,Amazon,Black MIrror Work Cotton Kurta-L,B0CBS623HL,Active
129-N.b.f Fashion,IM271378X- Mens Green Lining  Boxer - XXL,X- Mens Green Lining  Boxer - XXL,Amazon,X- Mens Green Lining  Boxer - XXL,B0FBJVDBNY,Active
129-N.b.f Fashion,IM037571Mens Kohli Style Red New KPNJ - S,Mens Kohli Style Red New KPNJ - S,Amazon,Mens Kohli Style Red New KPNJ - S,B09CGY3C7D,Active
129-N.b.f Fashion,IM037505Mens  Red Ranveer Indo-L,Mens Red Ranveer Indo-L,Amazon,Mens Red Ranveer Indo-L,B09CDVYXD9,Active
129-N.b.f Fashion,IM036398Mens Dayable Maroon Indo - XL,Mens Dayable Maroon Indo - XL,Amazon,Mens Dayable Maroon Indo - XL,B0CR48ZX2V,Active
129-N.b.f Fashion,IM037592Mens Light-Red Jeaquard Sherwani-XL,Mens Light-Red Jeaquard Sherwani-XL,Amazon,Mens Light-Red Jeaquard Sherwani-XL,B0CC8ZFNRN,Active
129-N.b.f Fashion,IM038319Mens Yellow Ranveer Indo-S,Mens Yellow Ranveer Indo-S,Amazon,Mens Yellow Ranveer Indo-S,B09CDTZTKL,Active
129-N.b.f Fashion,IM038174Mens R@nver Yallow Indo - M,Mens R@nver Yallow Indo - M,Amazon,Mens R@nver Yallow Indo - M,B09Y8W5SW6,Active
129-N.b.f Fashion,IM271370X- Mens Beige Boxer - XXL,X- Mens Beige Boxer - XXL,Amazon,X- Mens Beige Boxer - XXL,B0FBK4Q141,Active
129-N.b.f Fashion,IM034947Black long Koti Kurta-S,Black long Koti Kurta-S,Amazon,Black long Koti Kurta-S,B0CCRVVB7H,Active
129-N.b.f Fashion,IM036730Ranveer koti-XXL,Ranveer koti-XXL,Amazon,Ranveer koti-XXL,B094GWXTFT,Active
129-N.b.f Fashion,IM035560Mens RK Blue Indo - L,Mens RK Blue Indo - L,Amazon,Mens RK Blue Indo - L,B0C77D3ZCK,Active
129-N.b.f Fashion,IM037922Ranveer Singh Style - S,Ranveer Singh Style - S,Amazon,Ranveer Singh Style - S,B08KNGZ44R,Active
129-N.b.f Fashion,IM037666Mens Red Indo-S,Mens Red Indo-S,Amazon,Mens Red Indo-S,B0CBWQYD3P,Active
129-N.b.f Fashion,IM036692N Mens Black Long Koti Sherwani-L,N Mens Black Long Koti Sherwani-L,Amazon,N Mens Black Long Koti Sherwani-L,B0CFDY6PB7,Active
129-N.b.f Fashion,IM036336Mens Sky Embro Kurta-XXL,Mens Sky Embro Kurta-XXL,Amazon,Mens Sky Embro Kurta-XXL,B0CD2K2G9P,Active
129-N.b.f Fashion,IM035484Mens Embro Blue Kurta - M,Mens Embro Blue Kurta - M,Amazon,Mens Embro Blue Kurta - M,B0BWTQ9VQN,Active
129-N.b.f Fashion,IM314566Girls Wine F-S Choli 18-24 M,Girls Wine F-S Choli 18-24 M,Amazon,Girls Wine F-S Choli 18-24 M,B0G5FGP34Z,Active
129-N.b.f Fashion,IM038176Mens R@nver Yallow Indo - XL,Mens R@nver Yallow Indo - XL,Amazon,Mens R@nver Yallow Indo - XL,B09Y8VXVSL,Active
129-N.b.f Fashion,IM271356Mens Blue New Work Kurta - XXL,Mens Blue New Work Kurta - XXL,Amazon,Mens Blue New Work Kurta - XXL,B0F2N5HT4T,Active
129-N.b.f Fashion,IM036540Mens BlackBorder Indo-S,Mens BlackBorder Indo-S,Amazon,Mens BlackBorder Indo-S,B0CBVJQPWP,Active
129-N.b.f Fashion,IM186415A-Men_Black Pista Pattern KPNJ Set-L,A-Men_Black Pista Pattern KPNJ Set-L,Amazon,A-Men_Black Pista Pattern KPNJ Set-L,B0DD4F5CJC,Active
129-N.b.f Fashion,IM035552Mens RK Blue Fancey Indo - S,Mens RK Blue Fancey Indo - S,Amazon,Mens RK Blue Fancey Indo - S,B0C7883FDL,Active
129-N.b.f Fashion,IM037597Mens Light-Red Jequard Sherwani-XL,Mens Light-Red Jequard Sherwani-XL,Amazon,Mens Light-Red Jequard Sherwani-XL,B0CC8YK7P3,Active
129-N.b.f Fashion,IM035307Mens Blue Indo - M,Mens Blue Indo - M,Amazon,Mens Blue Indo - M,B097HQ5S7B,Active
129-N.b.f Fashion,IM037300Mens Dayable Purple Indo Set- XL,Mens Dayable Purple Indo Set- XL,Amazon,Mens Dayable Purple Indo Set- XL,B0CR955NF9,Active
129-N.b.f Fashion,IM035081Mens Dayable Black Indo - M,Mens Dayable Black Indo - M,Amazon,Mens Dayable Black Indo - M,B0CR49WT4Z,Active
129-N.b.f Fashion,IM037290Mens Dark Purple Indo Set -XL,Mens Dark Purple Indo Set -XL,Amazon,Mens Dark Purple Indo Set -XL,B0CR41Z8G2,Active
129-N.b.f Fashion,IM314529Girls Baby Pink Top Bottom 1-2 Y,Girls Baby Pink Top Bottom 1-2 Y,Amazon,Girls Baby Pink Top Bottom 1-2 Y,B0FTMJVTV9,Active
129-N.b.f Fashion,IM035014Mens Black Gold Indo Set - XXL,Mens Black Gold Indo Set - XXL,Amazon,Mens Black Gold Indo Set - XXL,B0CR1HQ3SJ,Active
129-N.b.f Fashion,IM035755Navy-Blue-White Embro kurta-XL,Navy-Blue-White Embro kurta-XL,Amazon,Navy-Blue-White Embro kurta-XL,B0CBSK1C1T,Active
129-N.b.f Fashion,IM037852N Mens Red Indo-XL,N Mens Red Indo-XL,Amazon,N Mens Red Indo-XL,B0CBVKDM22,Active
129-N.b.f Fashion,IM035002Mens Black Dayable Indo - XXL,Mens Black Dayable Indo - XXL,Amazon,Mens Black Dayable Indo - XXL,B0CR475CXW,Active
129-N.b.f Fashion,IM037841N Mens Dark Red Indo Western-M,N Mens Dark Red Indo Western-M,Amazon,N Mens Dark Red Indo Western-M,B08YDP1PQM,Active
129-N.b.f Fashion,IM037311Mens Dayable Ringni Indo - XXL,Mens Dayable Ringni Indo - XXL,Amazon,Mens Dayable Ringni Indo - XXL,B0CR461DD4,Active
129-N.b.f Fashion,IM035959Mens RK New Gold Indo - XL,Mens RK New Gold Indo - XL,Amazon,Mens RK New Gold Indo - XL,B0C9D3PHSC,Active
129-N.b.f Fashion,IM038228Mens Yellow Jq New Indo-L,Mens Yellow Jq New Indo-L,Amazon,Mens Yellow Jq New Indo-L,B0CQ22D746,Active
129-N.b.f Fashion,IM035460Mens Blue Silver Shade Indo - M,Mens Blue Silver Shade Indo - M,Amazon,Mens Blue Silver Shade Indo - M,B09CDW66J3,Active
129-N.b.f Fashion,IM314560Girls D Blue Wings Frock 4-5 Y,Girls D Blue Wings Frock 4-5 Y,Amazon,Girls D Blue Wings Frock 4-5 Y,B0G5FGYT8W,Active
129-N.b.f Fashion,IM037642Mens Red Embro Kurta Set  - L,Mens Red Embro Kurta Set  - L,Amazon,Mens Red Embro Kurta Set - L,B0B864VCV7,Active
129-N.b.f Fashion,IM036096Mens Green Lakhanvi Embro Kurta- L,Mens Green Lakhanvi Embro Kurta- L,Amazon,Mens Green Lakhanvi Embro Kurta- L,B0BWTPYHQP,Active
129-N.b.f Fashion,IM036722N Multi Silver Indo For Mens-XL,N Multi Silver Indo For Mens-XL,Amazon,N Multi Silver Indo For Mens-XL,B0BXH94KJ1,Active
129-N.b.f Fashion,IM037509Mens  Red Ranveer Indo-XXL,Mens  Red Ranveer Indo-XXL,Amazon,Mens  Red Ranveer Indo-XXL,B09CDVX2GH,Active
129-N.b.f Fashion,IM322451Womens Cream Printed Kurti Set - XL,Womens Cream Printed Kurti Set - XL,Amazon,Womens Cream Printed Kurti Set - XL,B0G6ZJL79P,Active
129-N.b.f Fashion,IM192440Mens Black Green Koti Kurta 117- XXL,Mens Black Green Koti Kurta 117- XXL,Amazon,Mens Black Green Koti Kurta 117- XXL,B0D2L4XPXT,Active
129-N.b.f Fashion,IM314502Girls Perot Top Bottom 3-4 Y,Girls Perot Top Bottom 3-4 Y,Amazon,Girls Perot Top Bottom 3-4 Y,B0FTMKHW9Q,Active
129-N.b.f Fashion,IM037814Mens Stylish Ranver Red  Indo-S,Mens Stylish Ranver Red  Indo-S,Amazon,Mens Stylish Ranver Red  Indo-S,B09FTHZYZZ,Active
129-N.b.f Fashion,IM192447Mens 125 Black Green Indo Set - L,Mens 125 Black Green Indo Set - L,Amazon,Mens 125 Black Green Indo Set - L,B0D2NSYDCF,Active
129-N.b.f Fashion,IM271419X- Mens grey Boxer - XL,X- Mens grey Boxer - XL,Amazon,X- Mens grey Boxer - XL,B0FBJMQ1DC,Active
129-N.b.f Fashion,IM185997Mens Blue Satin Pattern Indo - XL,Mens Blue Satin Pattern Indo - XL,Amazon,Mens Blue Satin Pattern Indo - XL,B0DCVJ4YYR,Active
129-N.b.f Fashion,IM035227Men Blue Dayable Indo Set - M,Men Blue Dayable Indo Set - M,Amazon,Men Blue Dayable Indo Set - M,B0CR95KKNN,Active
129-N.b.f Fashion,IM314605Girls Wine F-S Choli 4-5 Y,Girls Wine F-S Choli 4-5 Y,Amazon,Girls Wine F-S Choli 4-5 Y,B0G5FCS8S8,Active
129-N.b.f Fashion,IM037332Purple Mirrir Work Kurta-L,Purple Mirrir Work Kurta-L,Amazon,Purple Mirrir Work Kurta-L,B0CBS3PK7G,Active
129-N.b.f Fashion,IM211642Mens Black-Yellow Long Koti Kurta - L,Mens Black-Yellow Long Koti Kurta - L,Amazon,Mens Black-Yellow Long Koti Kurta - L,B0DR6S1CMK,Active
129-N.b.f Fashion,IM037921Ranveer Singh Style - L,Ranveer Singh Style - L,Amazon,Ranveer Singh Style - L,B08KNFVQN8,Active
129-N.b.f Fashion,IM192485Mens Cream Cotton Kurta Wine Koti - L,Mens Cream Cotton Kurta Wine Koti - L,Amazon,Mens Cream Cotton Kurta Wine Koti - L,B0D45365FQ,Active
129-N.b.f Fashion,IM036747X N Mens Black Long Koti Sherwani-M,X N Mens Black Long Koti Sherwani-M,Amazon,X N Mens Black Long Koti Sherwani-M,B0CLRR7P8V,Active
129-N.b.f Fashion,IM036214Q1-O6ZK-HWRL,Q1-O6ZK-HWRL,Amazon,Q1-O6ZK-HWRL,B0CBPFNP7H,Active
129-N.b.f Fashion,IM037931Red Indo For Mens -XL,Red Indo For Mens -XL,Amazon,Red Indo For Mens -XL,B0BX42GC7W,Active
129-N.b.f Fashion,IM038301Mens Yellow Ranveer I.W - S,Mens Yellow Ranveer I.W - S,Amazon,Mens Yellow Ranveer I.W - S,B099QKW557,Active
129-N.b.f Fashion,IM035111Mens RK Black Indo - XXL,Mens RK Black Indo - XXL,Amazon,Mens RK Black Indo - XXL,B0C9DV9PP1,Active
129-N.b.f Fashion,IM036719N Multi Silver Indo For Mens-L,N Multi Silver Indo For Mens-L,Amazon,N Multi Silver Indo For Mens-L,B0BXH8T3BG,Active
129-N.b.f Fashion,IM271409X- Mens Beige Red Linig  Boxer - XL,X- Mens Beige Red Linig  Boxer - XL,Amazon,X- Mens Beige Red Linig  Boxer - XL,B0FBJYNGT2,Active
129-N.b.f Fashion,IM035464Mens Blue Silver Shade Indo -XXL,Mens Blue Silver Shade Indo -XXL,Amazon,Mens Blue Silver Shade Indo -XXL,B09CDV3SJM,Active
129-N.b.f Fashion,IM035107Mens RK Black Indo - L,Mens RK Black Indo - L,Amazon,Mens RK Black Indo - L,B0C9D5F7F3,Active
129-N.b.f Fashion,IM037561Mens Kohli Style Red KPNJ  - S,Mens Kohli Style Red KPNJ  - S,Amazon,Mens Kohli Style Red KPNJ - S,B09B1V3LN7,Active
129-N.b.f Fashion,IM036487Men Cream Gold Indo-XL,Men Cream Gold Indo-XL,Amazon,Men Cream Gold Indo-XL,B0CBV6ZVWM,Active
129-N.b.f Fashion,IM037175Mens Pink  Jq New Indo - XXL,Mens Pink  Jq New Indo - XXL,Amazon,Mens Pink  Jq New Indo - XXL,B0CQ26G7P1,Active
129-N.b.f Fashion,IM037457Men R-C NewSide Indo Set - XL,Men R-C NewSide Indo Set - XL,Amazon,Men R-C NewSide Indo Set - XL,B0CR1GC8QC,Active
129-N.b.f Fashion,IM314536Girls Cream Co-ords Set 6-7 Y,Girls Cream Co-ords Set 6-7 Y,Amazon,Girls Cream Co-ords Set 6-7 Y,B0G5FWWKDD,Active
129-N.b.f Fashion,IM035127Mens-Kurta-S,Mens-Kurta-S,Amazon,Mens-Kurta-S,B0CBMPXQC2,Active
129-N.b.f Fashion,IM036553Mens Cream Red Indo-S,Mens Cream Red Indo-S,Amazon,Mens Cream Red Indo-S,B0CBV8G54J,Active
129-N.b.f Fashion,IM036557Mens Cream-Gold Indo-L,Mens Cream-Gold Indo-L,Amazon,Mens Cream-Gold Indo-L,B0CBVJ9KDY,Active
129-N.b.f Fashion,IM284194A- Baby Girls Maroon Frock 4-5 Y,A- Baby Girls Maroon Frock 4-5 Y,Amazon,A- Baby Girls Maroon Frock 4-5 Y,B0FN44P94T,Active
129-N.b.f Fashion,IM035316Mens Blue Indo West-S,Mens Blue Indo West-S,Amazon,Mens Blue Indo West-S,B096BBP2J3,Active
129-N.b.f Fashion,IM192476Mens Black Green Long Koti Kurta 117- L,Mens Black Green Long Koti Kurta 117- L,Amazon,Mens Black Green Long Koti Kurta 117- L,B0D2L4RBDM,Active
129-N.b.f Fashion,IM192483Mens-130 Green Jq Indo Set - XXL,Mens-130 Green Jq Indo Set - XXL,Amazon,Mens-130 Green Jq Indo Set - XXL,B0D2NS3WYP,Active
129-N.b.f Fashion,IM037612Mens R@nveer Red Indo -  S,Mens R@nveer Red Indo -  S,Amazon,Mens R@nveer Red Indo -  S,B09Y8SHQYY,Active
129-N.b.f Fashion,IM314521Girls Black Top Bottom 3-4 Y,Girls Black Top Bottom 3-4 Y,Amazon,Girls Black Top Bottom 3-4 Y,B0FTMJK7S8,Active
129-N.b.f Fashion,IM036254N Mens Pista Embro Kurta-L,N Mens Pista Embro Kurta-L,Amazon,N Mens Pista Embro Kurta-L,B0CD2L6R44,Active
129-N.b.f Fashion,IM337632Mens Black Multi Indo Set- M,Mens Black Multi Indo Set- M,Amazon,Mens Black Multi Indo Set- M,B0GPDH3CNM,Active
129-N.b.f Fashion,IM036335Mens Sky Embro Kurta-XL,Mens Sky Embro Kurta-XL,Amazon,Mens Sky Embro Kurta-XL,B0CD2LYZQ2,Active
129-N.b.f Fashion,IM037672Mens Red Indo-xl,Mens Red Indo-xl,Amazon,Mens Red Indo-xl,B0CBWS25LR,Active
129-N.b.f Fashion,IM271385X- Mens Beige Dark Purple Boxer - L,X- Mens Beige Dark Purple Boxer - L,Amazon,X- Mens Beige Dark Purple Boxer - L,B0FBK6X42Z,Active
129-N.b.f Fashion,IM284238A-Mens Black Dayable Indo_2XL,A-Mens Black Dayable Indo_2XL,Amazon,A-Mens Black Dayable Indo_2XL,B0FM83N353,Active
129-N.b.f Fashion,IM314609Girls Yellow Choli 2-3 Y,Girls Yellow Choli 2-3 Y,Amazon,Girls Yellow Choli 2-3 Y,B0G5FV7NKN,Active
129-N.b.f Fashion,IM037613Mens R@nveer Red Indo -  XL,Mens R@nveer Red Indo -  XL,Amazon,Mens R@nveer Red Indo -  XL,B09Y8VH2ZV,Active
129-N.b.f Fashion,IM035070Mens Black Silver Indo - S,Mens Black Silver Indo - S,Amazon,Mens Black Silver Indo - S,B0CJFRZB4N,Active
129-N.b.f Fashion,IM314599Girls Green Top Bottom 7-8 Y,Girls Green Top Bottom 7-8 Y,Amazon,Girls Green Top Bottom 7-8 Y,B0FTML4KLQ,Active
129-N.b.f Fashion,IM314585Girls Wine S-S Choli 5-6 Y,Girls Wine S-S Choli 5-6 Y,Amazon,Girls Wine S-S Choli 5-6 Y,B0G5GDJ4SL,Active
129-N.b.f Fashion,IM211645Mens Black-Yellow Long Koti Kurta - XL,Mens Black-Yellow Long Koti Kurta - XL,Amazon,Mens Black-Yellow Long Koti Kurta - XL,B0DR6SLTSV,Active
129-N.b.f Fashion,IM034991Mens (A) Black Pattern Indo -XL,Mens (A) Black Pattern Indo -XL,Amazon,Mens (A) Black Pattern Indo -XL,B0CR7SXT6G,Active
