Vendor Code,Master SKU,SKU,Channel,Channel SKU,Identifier,Status (Active / Inactive)
129-N.b.f Fashion,IM037108Mens Dark Pink Embroidery Kurta - XL,Mens Dark Pink Embroidery Kurta - XL,Amazon,Mens Dark Pink Embroidery Kurta - XL,B0BWTMFJ7Z,Active
129-N.b.f Fashion,IM271414Mens Lime Green Seq Kurta Set - M,Mens Lime Green Seq Kurta Set - M,Amazon,Mens Lime Green Seq Kurta Set - M,B0F9X6FMRS,Active
129-N.b.f Fashion,IM034990Mens (A) Black Pattern Indo -S,Mens (A) Black Pattern Indo -S,Amazon,Mens (A) Black Pattern Indo -S,B0CR7RH84K,Active
129-N.b.f Fashion,IM037608Mens R.Red Indo - XL,Mens R.Red Indo - XL,Amazon,Mens R.Red Indo - XL,B09SYVZH9X,Active
129-N.b.f Fashion,IM036450Blue-White Embro Kurta-XL,Blue-White Embro Kurta-XL,Amazon,Blue-White Embro Kurta-XL,B0CBSJ5R72,Active
129-N.b.f Fashion,IM035667Mens Yellow JQ Ranveer Indo-S,Mens Yellow JQ Ranveer Indo-S,Amazon,Mens Yellow JQ Ranveer Indo-S,B0BXH5L1WK,Active
129-N.b.f Fashion,IM037811Mens Stylish Ranver Red  Indo- XL,Mens Stylish Ranver Red Indo- XL,Amazon,Mens Stylish Ranver Red Indo- XL,B09FTG86KC,Active
129-N.b.f Fashion,IM038439X N mens blue indo - xl,X N mens blue indo - xl,Amazon,X N mens blue indo - xl,B0966YQPZ8,Active
129-N.b.f Fashion,IM192433Mens Long White Kurta Green Koti 121- L,Mens Long White Kurta Green Koti 121- L,Amazon,Mens Long White Kurta Green Koti 121- L,B0D2LF23HK,Active
129-N.b.f Fashion,IM186408Mens Black Kurta Pattern Koti Set - XXL,Mens Black Kurta Pattern Koti Set - XXL,Amazon,Mens Black Kurta Pattern Koti Set - XXL,B0DCZPD53Z,Active
129-N.b.f Fashion,IM035065Mens Black Pattern Indo - XL,Mens Black Pattern Indo - XL,Amazon,Mens Black Pattern Indo - XL,B0CR1B946P,Active
129-N.b.f Fashion,IM036988N Mens Kohli Cream Red Indo-M,N Mens Kohli Cream Red Indo-M,Amazon,N Mens Kohli Cream Red Indo-M,B0CD24M1C1,Active
129-N.b.f Fashion,IM036256N Mens Pista Embro Kurta-S,N Mens Pista Embro Kurta-S,Amazon,N Mens Pista Embro Kurta-S,B0CD2JYSD1,Active
129-N.b.f Fashion,IM035194Embro Blue Kurta Mens - XXL,Embro Blue Kurta Mens - XXL,Amazon,Embro Blue Kurta Mens - XXL,B0BZYWHB9H,Active
129-N.b.f Fashion,IM035137N Black long Koti Kurta-M,N Black long Koti Kurta-M,Amazon,N Black long Koti Kurta-M,B0CCRKY4D8,Active
129-N.b.f Fashion,IM035052Mens Black Mirror Work Kurta - XL,Mens Black Mirror Work Kurta - XL,Amazon,Mens Black Mirror Work Kurta - XL,B0CBFR64DN,Active
129-N.b.f Fashion,IM036628Mens Ranveer Singh Indo Western -XXL,Mens Ranveer Singh Indo Western -XXL,Amazon,Mens Ranveer Singh Indo Western -XXL,B094WBLZT5,Active
129-N.b.f Fashion,IM035268Mens (A) Blue Flower Indo Set - L,Mens (A) Blue Flower Indo Set - L,Amazon,Mens (A) Blue Flower Indo Set - L,B0CR7Q5WB9,Active
129-N.b.f Fashion,IM035011Mens Black Gold Indo Set - S,Mens Black Gold Indo Set - S,Amazon,Mens Black Gold Indo Set - S,B0CR1L73B8,Active
129-N.b.f Fashion,IM284234X-Mens Maroon Satin Pattern Indo-XXL_new,X-Mens Maroon Satin Pattern Indo-XXL_new,Amazon,X-Mens Maroon Satin Pattern Indo-XXL_new,B0FM7RQG7V,Active
129-N.b.f Fashion,IM037490MEN-2020821-NJ-RED-XL,MEN-2020821-NJ-RED-XL,Amazon,MEN-2020821-NJ-RED-XL,B08QRWZG48,Active
129-N.b.f Fashion,IM314567Girls Baby Pink Top Bottom 7-8 Y,Girls Baby Pink Top Bottom 7-8 Y,Amazon,Girls Baby Pink Top Bottom 7-8 Y,B0FTMKSWSR,Active
129-N.b.f Fashion,IM271387X- Mens Beige Dark Purple Boxer - XXL,X- Mens Beige Dark Purple Boxer - XXL,Amazon,X- Mens Beige Dark Purple Boxer - XXL,B0FBJRGT3T,Active
129-N.b.f Fashion,IM192445Mens 125 Black Green Indo Set - XXL,Mens 125 Black Green Indo Set - XXL,Amazon,Mens 125 Black Green Indo Set - XXL,B0D2NWP7R4,Active
129-N.b.f Fashion,IM284218A-Men Blue Long Koti Kurta_2XL,A-Men Blue Long Koti Kurta_2XL,Amazon,A-Men Blue Long Koti Kurta_2XL,B0FM7ZJ8MF,Active
129-N.b.f Fashion,IM037573Mens Kohli Style Red New KPNJ -XL,Mens Kohli Style Red New KPNJ -XL,Amazon,Mens Kohli Style Red New KPNJ -XL,B09CGXT2FC,Active
129-N.b.f Fashion,IM037384Embro Maroon Kurta Mens - XXL,Embro Maroon Kurta Mens - XXL,Amazon,Embro Maroon Kurta Mens - XXL,B0BZYWTSGT,Active
129-N.b.f Fashion,IM284154A- Baby Girls Pink Frock 5-6 Y,A- Baby Girls Pink Frock 5-6 Y,Amazon,A- Baby Girls Pink Frock 5-6 Y,B0FN44J4GZ,Active
129-N.b.f Fashion,IM037288Mens Dark Purple Indo Set -L,Mens Dark Purple Indo Set -L,Amazon,Mens Dark Purple Indo Set -L,B0CR45FH31,Active
129-N.b.f Fashion,IM037501Men-KTPJNJ-20200821-Red  -S,Men-KTPJNJ-20200821-Red  -S,Amazon,Men-KTPJNJ-20200821-Red -S,B08W1X6MHY,Active
129-N.b.f Fashion,IM037662Mens Red indo Sherwani-XL,Mens Red indo Sherwani-XL,Amazon,Mens Red indo Sherwani-XL,B0CC8Q2RD6,Active
129-N.b.f Fashion,IM137542A Mens Blue Seq Koti Kurta Set 802- XXL,A Mens Blue Seq Koti Kurta Set 802- XXL,Amazon,A Mens Blue Seq Koti Kurta Set 802- XXL,B0CXPNTLX3,Active
129-N.b.f Fashion,IM036413Mens Maroon MKPNJ- XL,Mens Maroon MKPNJ- XL,Amazon,Mens Maroon MKPNJ- XL,B08KNC7KYG,Active
129-N.b.f Fashion,IM036360N Mens Sky Embro Kurta-XL,N Mens Sky Embro Kurta-XL,Amazon,N Mens Sky Embro Kurta-XL,B0CD2KY4KF,Active
129-N.b.f Fashion,IM284237A-Mens Black Dayable Indo_L,A-Mens Black Dayable Indo_L,Amazon,A-Mens Black Dayable Indo_L,B0FM83ZP96,Active
129-N.b.f Fashion,IM322447Womens Sky Printed Kurti Set - M,Womens Sky Printed Kurti Set - M,Amazon,Womens Sky Printed Kurti Set - M,B0G6ZR9RGF,Active
129-N.b.f Fashion,IM284220X-Mens Mahendi Pattern Indo Set-S_new,X-Mens Mahendi Pattern Indo Set-S_new,Amazon,X-Mens Mahendi Pattern Indo Set-S_new,B0FM7VLJ63,Active
129-N.b.f Fashion,IM271390X- Mens grey Boxer - M,X- Mens grey Boxer - M,Amazon,X- Mens grey Boxer - M,B0FBK4NS3G,Active
129-N.b.f Fashion,IM037306Mens Dayable Purrple Indo - XXL,Mens Dayable Purrple Indo - XXL,Amazon,Mens Dayable Purrple Indo - XXL,B0CR48BWJN,Active
129-N.b.f Fashion,IM036700N Mens Cream-Gold Indo-XL,N Mens Cream-Gold Indo-XL,Amazon,N Mens Cream-Gold Indo-XL,B0CBVH6PWH,Active
129-N.b.f Fashion,IM035576Mens RK Light Blue Indo-M,Mens RK Light Blue Indo-M,Amazon,Mens RK Light Blue Indo-M,B0C945N1WL,Active
129-N.b.f Fashion,IM314595Girls D SKY Printed Frock 18-24 M,Girls D SKY Printed Frock 18-24 M,Amazon,Girls D SKY Printed Frock 18-24 M,B0G5FG9T6P,Active
129-N.b.f Fashion,IM314564Womens Yellow Kurti Set - XL,Womens Yellow Kurti Set - XL,Amazon,Womens Yellow Kurti Set - XL,B0G5FYXWKR,Active
129-N.b.f Fashion,IM036319Mens Lakhanvi  Sky Embro Kurta - L,Mens Lakhanvi  Sky Embro Kurta - L,Amazon,Mens Lakhanvi  Sky Embro Kurta - L,B0BWTWJBX2,Active
129-N.b.f Fashion,IM037110Mens Dark Pink Embroidery Kurta -S,Mens Dark Pink Embroidery Kurta -S,Amazon,Mens Dark Pink Embroidery Kurta -S,B0BWTPRJ1K,Active
129-N.b.f Fashion,IM186037A-Men Blue Satin Pattern Indo Set -XL,A-Men Blue Satin Pattern Indo Set -XL,Amazon,A-Men Blue Satin Pattern Indo Set -XL,B0DD4DC6TN,Active
129-N.b.f Fashion,IM035298Mens Blue Embro Kurta - L,Mens Blue Embro Kurta - L,Amazon,Mens Blue Embro Kurta - L,B0B865GWCF,Active
129-N.b.f Fashion,IM036488Men Cream Gold Indo-XXL,Men Cream Gold Indo-XXL,Amazon,Men Cream Gold Indo-XXL,B0CBV6WZ3J,Active
129-N.b.f Fashion,IM037545Mens Embro Red Kurta - L,Mens Embro Red Kurta - L,Amazon,Mens Embro Red Kurta - L,B0BWRYYK43,Active
129-N.b.f Fashion,IM037656Mens Red Ijequard indo-S,Mens Red Ijequard indo-S,Amazon,Mens Red Ijequard indo-S,B0CC8S5N89,Active
129-N.b.f Fashion,IM186040A-Men Maroon Indo Set -XL,A-Men Maroon Indo Set -XL,Amazon,A-Men Maroon Indo Set -XL,B0DD4D4S22,Active
129-N.b.f Fashion,IM037630Mens Red  Lakhanvi kurta- S,Mens Red  Lakhanvi kurta- S,Amazon,Mens Red  Lakhanvi kurta- S,B0B5HGCNYK,Active
129-N.b.f Fashion,IM337639Mens Light Pink Koti Kurta Set - M,Mens Light Pink Koti Kurta Set - M,Amazon,Mens Light Pink Koti Kurta Set - M,B0GPD7MMCG,Active
129-N.b.f Fashion,IM035686Multi Silver Indo For Mens-XXL,Multi Silver Indo For Mens-XXL,Amazon,Multi Silver Indo For Mens-XXL,B0BX46TY3H,Active
129-N.b.f Fashion,IM037762Mens RK Dark Red Indo - L,Mens RK Dark Red Indo - L,Amazon,Mens RK Dark Red Indo - L,B0C9J2CLY6,Active
129-N.b.f Fashion,IM037570Mens Kohli Style Red New KPNJ - M,Mens Kohli Style Red New KPNJ - M,Amazon,Mens Kohli Style Red New KPNJ - M,B09CGVT8Z1,Active
129-N.b.f Fashion,IM0370227P-CIP6-HBTC,7P-CIP6-HBTC,Amazon,7P-CIP6-HBTC,B0CBQ1QMM7,Active
129-N.b.f Fashion,IM284163Baby Girls Light Purple Frock 5-6 Y,Baby Girls Light Purple Frock 5-6 Y,Amazon,Baby Girls Light Purple Frock 5-6 Y,B0FN44RC3P,Active
129-N.b.f Fashion,IM037555Mens Kohli Koti Kurta Set - M,Mens Kohli Koti Kurta Set - M,Amazon,Mens Kohli Koti Kurta Set - M,B09SWBX31L,Active
129-N.b.f Fashion,IM036489Men Cream zade Indo Set - L,Men Cream zade Indo Set - L,Amazon,Men Cream zade Indo Set - L,B0CR93MRTB,Active
129-N.b.f Fashion,IM037827Mnns Red Silver Indo - XXL,Mnns Red Silver Indo - XXL,Amazon,Mnns Red Silver Indo - XXL,B0B851M3LS,Active
129-N.b.f Fashion,IM037960Red-White Embro kurta-XXL,Red-White Embro kurta-XXL,Amazon,Red-White Embro kurta-XXL,B0CBSGW235,Active
129-N.b.f Fashion,IM037312Mens Dayable Wine Indo Set - M,Mens Dayable Wine Indo Set - M,Amazon,Mens Dayable Wine Indo Set - M,B0CR94SZQ3,Active
129-N.b.f Fashion,IM037912Ranveer Koti Kurta - XXK,Ranveer Koti Kurta - XXK,Amazon,Ranveer Koti Kurta - XXK,B095M6DH8T,Active
129-N.b.f Fashion,IM037696Mens Red JQ Ranveer Indo-S,Mens Red JQ Ranveer Indo-S,Amazon,Mens Red JQ Ranveer Indo-S,B0BX3WS16Q,Active
129-N.b.f Fashion,IM192456Mens Long White Kurta Green Koti 121- S,Mens Long White Kurta Green Koti 121- S,Amazon,Mens Long White Kurta Green Koti 121- S,B0D2LG227C,Active
129-N.b.f Fashion,IM036782Navy Blue-White Embro Kurta Set-XXL,Navy Blue-White Embro Kurta Set-XXL,Amazon,Navy Blue-White Embro Kurta Set-XXL,B0B6VPRY31,Active
129-N.b.f Fashion,IM337626Mens Grey Koti Kurta Set - S,Mens Grey Koti Kurta Set - S,Amazon,Mens Grey Koti Kurta Set - S,B0GPD7HKLQ,Active
129-N.b.f Fashion,IM284167A- Baby Girls Maroon Frock 6-12 M,A- Baby Girls Maroon Frock 6-12 M,Amazon,A- Baby Girls Maroon Frock 6-12 M,B0FN46H9BT,Active
129-N.b.f Fashion,IM035317Mens Blue Indo West-XL,Mens Blue Indo West-XL,Amazon,Mens Blue Indo West-XL,B096BCP6Y1,Active
129-N.b.f Fashion,IM038313Mens Yellow Ranveer Indo West- XXL,Mens Yellow Ranveer Indo West- XXL,Amazon,Mens Yellow Ranveer Indo West- XXL,B0983GL6NZ,Active
129-N.b.f Fashion,IM186030Mens Yellow Satin Pattern Indo - XL,Mens Yellow Satin Pattern Indo - XL,Amazon,Mens Yellow Satin Pattern Indo - XL,B0DCZCL676,Active
129-N.b.f Fashion,IM036361N Mens Sky Embro Kurta-XXL,N Mens Sky Embro Kurta-XXL,Amazon,N Mens Sky Embro Kurta-XXL,B0CD2LC5BR,Active
129-N.b.f Fashion,IM284171Baby Girls Rani Pink Frock 18-24 M,Baby Girls Rani Pink Frock 18-24 M,Amazon,Baby Girls Rani Pink Frock 18-24 M,B0FN45N1XZ,Active
129-N.b.f Fashion,IM036299YG-ELOU-OQO3,YG-ELOU-OQO3,Amazon,YG-ELOU-OQO3,B0CBPGQVYY,Active
129-N.b.f Fashion,IM038308Mens Yellow Ranveer Indo West - XL,Mens Yellow Ranveer Indo West - XL,Amazon,Mens Yellow Ranveer Indo West - XL,B09Y1KW2JW,Active
129-N.b.f Fashion,IM314519Girls D SKY Printed Frock 5-6 Y,Girls D SKY Printed Frock 5-6 Y,Amazon,Girls D SKY Printed Frock 5-6 Y,B0G5FD85Y7,Active
129-N.b.f Fashion,IM036099Mens Green Lakhanvi Embro Kurta- Xl,Mens Green Lakhanvi Embro Kurta- Xl,Amazon,Mens Green Lakhanvi Embro Kurta- Xl,B0BWTP17G2,Active
129-N.b.f Fashion,IM037350Mens Ringni Dayable Indo - M,Mens Ringni Dayable Indo - M,Amazon,Mens Ringni Dayable Indo - M,B0CR4848QY,Active
129-N.b.f Fashion,IM038226Mens Yellow Jq New Indo -XL,Mens Yellow Jq New Indo -XL,Amazon,Mens Yellow Jq New Indo -XL,B0CQ21KPSM,Active
129-N.b.f Fashion,IM037493MEN-821-KPNJ-RED-XL,MEN-821-KPNJ-RED-XL,Amazon,MEN-821-KPNJ-RED-XL,B08QMJ1HRV,Active
129-N.b.f Fashion,IM035100Mens Mirrar Work Black Kurta - L,Mens Mirrar Work Black Kurta - L,Amazon,Mens Mirrar Work Black Kurta - L,B0CBLTX7QZ,Active
129-N.b.f Fashion,IM137564Mens Green Jodhpuri Kurta 801- S,Mens Green Jodhpuri Kurta 801- S,Amazon,Mens Green Jodhpuri Kurta 801- S,B0CXMVQYTL,Active
129-N.b.f Fashion,IM035233Men Blue Long Koti Kurta Set - L,Men Blue Long Koti Kurta Set - L,Amazon,Men Blue Long Koti Kurta Set - L,B0CQVLXN3G,Active
129-N.b.f Fashion,IM036748X N Mens Black Long Koti Sherwani-XL,X N Mens Black Long Koti Sherwani-XL,Amazon,X N Mens Black Long Koti Sherwani-XL,B0CLRQSL2S,Active
129-N.b.f Fashion,IM038113Mens Black Mirror Work Kurta-XL,Mens Black Mirror Work Kurta-XL,Amazon,Mens Black Mirror Work Kurta-XL,B0CFYJS6QM,Active
129-N.b.f Fashion,IM036396Mens Dayable Maroon Indo - M,Mens Dayable Maroon Indo - M,Amazon,Mens Dayable Maroon Indo - M,B0CR49G2J4,Active
129-N.b.f Fashion,IM036790Navyblue-White Embro kurta-XXL,Navyblue-White Embro kurta-XXL,Amazon,Navyblue-White Embro kurta-XXL,B0B6RSRYG5,Active
129-N.b.f Fashion,IM035064Mens Black Pattern Indo - S,Mens Black Pattern Indo - S,Amazon,Mens Black Pattern Indo - S,B0CR1C14BT,Active
129-N.b.f Fashion,IM035567Mens RK Dark Blue Indo - S,Mens RK Dark Blue Indo - S,Amazon,Mens RK Dark Blue Indo - S,B0CPYFK9JY,Active
129-N.b.f Fashion,IM192412Mens Cream Cotton Kurta Red Koti - L,Mens Cream Cotton Kurta Red Koti - L,Amazon,Mens Cream Cotton Kurta Red Koti - L,B0D45DF1CK,Active
129-N.b.f Fashion,IM037569Mens Kohli Style Red New KPNJ - L,Mens Kohli Style Red New KPNJ - L,Amazon,Mens Kohli Style Red New KPNJ - L,B09CGX282F,Active
129-N.b.f Fashion,IM036555Mens Cream Red Indo-XXL,Mens Cream Red Indo-XXL,Amazon,Mens Cream Red Indo-XXL,B0CBV7JQQK,Active
129-N.b.f Fashion,IM037348Mens Dayable Wine Indo - XXL,Mens Dayable Wine Indo - XXL,Amazon,Mens Dayable Wine Indo - XXL,B0CR48XCGZ,Active
129-N.b.f Fashion,IM035463Mens Blue Silver Shade Indo -XL,Mens Blue Silver Shade Indo -XL,Amazon,Mens Blue Silver Shade Indo -XL,B09CDWG1C6,Active
129-N.b.f Fashion,IM036011X N MENS GOLD INDO - L,X N MENS GOLD INDO - L,Amazon,X N MENS GOLD INDO - L,B0B855TVFQ,Active
129-N.b.f Fashion,IM036144Mens Mahendi Jeaquard Kurta-M,Mens Mahendi Jeaquard Kurta-M,Amazon,Mens Mahendi Jeaquard Kurta-M,B0CCVQFSY3,Active
129-N.b.f Fashion,IM284224X-Mens Mahendi Pattern Indo Set-L_new,X-Mens Mahendi Pattern Indo Set-L_new,Amazon,X-Mens Mahendi Pattern Indo Set-L_new,B0FM7TBRL9,Active
129-N.b.f Fashion,IM036698N Mens Cream-Gold Indo-M,N Mens Cream-Gold Indo-M,Amazon,N Mens Cream-Gold Indo-M,B0CBVKJKYB,Active
129-N.b.f Fashion,IM037631Mens Red  Lakhanvi kurta- XL,Mens Red  Lakhanvi kurta- XL,Amazon,Mens Red  Lakhanvi kurta- XL,B0B5HDKTZR,Active
129-N.b.f Fashion,IM037614Mens R@nveer Red Indo -  XXL,Mens R@nveer Red Indo -  XXL,Amazon,Mens R@nveer Red Indo -  XXL,B09Y8X7B8H,Active
129-N.b.f Fashion,IM314498Girls Yellow Choli 3-4 Y,Girls Yellow Choli 3-4 Y,Amazon,Girls Yellow Choli 3-4 Y,B0G5FYJMBP,Active
129-N.b.f Fashion,IM314520Girls Black Top Bottom 7-8 Y,Girls Black Top Bottom 7-8 Y,Amazon,Girls Black Top Bottom 7-8 Y,B0FTMJ68NH,Active
129-N.b.f Fashion,IM137531Mens Seq New Blue Indo - XXL,Mens Seq New Blue Indo - XXL,Amazon,Mens Seq New Blue Indo - XXL,B0CXJ9DCW8,Active
129-N.b.f Fashion,IM036490Men Cream zade Indo Set - M,Men Cream zade Indo Set - M,Amazon,Men Cream zade Indo Set - M,B0CR93T3WZ,Active
129-N.b.f Fashion,IM035269Mens (A) Blue Flower Indo Set - M,Mens (A) Blue Flower Indo Set - M,Amazon,Mens (A) Blue Flower Indo Set - M,B0CR7R1KVM,Active
129-N.b.f Fashion,IM037557Mens Kohli Koti Kurta Set - XL,Mens Kohli Koti Kurta Set - XL,Amazon,Mens Kohli Koti Kurta Set - XL,B09SWCKN64,Active
129-N.b.f Fashion,IM037546Mens Embro Red Kurta - M,Mens Embro Red Kurta - M,Amazon,Mens Embro Red Kurta - M,B0BWRZ9GGY,Active
129-N.b.f Fashion,IM284221X-Mens Mahendi Pattern Indo Set-XXL_new,X-Mens Mahendi Pattern Indo Set-XXL_new,Amazon,X-Mens Mahendi Pattern Indo Set-XXL_new,B0FM7RG622,Active
129-N.b.f Fashion,IM038013N Mens Rama Indo-S,N Mens Rama Indo-S,Amazon,N Mens Rama Indo-S,B0BXH78JY2,Active
129-N.b.f Fashion,IM035566Mens RK Dark Blue Indo - M,Mens RK Dark Blue Indo - M,Amazon,Mens RK Dark Blue Indo - M,B0CPYFSZW5,Active
129-N.b.f Fashion,IM037698Mens Red JQ Ranveer Indo-XXL,Mens Red JQ Ranveer Indo-XXL,Amazon,Mens Red JQ Ranveer Indo-XXL,B0BX3GMF23,Active
129-N.b.f Fashion,IM035237Men Blue Long Koti Kurta Set - XXL,Men Blue Long Koti Kurta Set - XXL,Amazon,Men Blue Long Koti Kurta Set - XXL,B0CQVM5N8V,Active
129-N.b.f Fashion,IM038112Mens Black Mirror Work Kurta-S,Mens Black Mirror Work Kurta-S,Amazon,Mens Black Mirror Work Kurta-S,B0CFYGXMN1,Active
129-N.b.f Fashion,IM284225X-Mens Black Long Koti Sherwani-L_new,X-Mens Black Long Koti Sherwani-L_new,Amazon,X-Mens Black Long Koti Sherwani-L_new,B0FM7RCWCB,Active
129-N.b.f Fashion,IM037360821-NEW-NJ-M,821-NEW-NJ-M,Amazon,821-NEW-NJ-M,B08QMQCRDF,Active
129-N.b.f Fashion,IM037172Mens Pink  Jq New Indo - M,Mens Pink  Jq New Indo - M,Amazon,Mens Pink  Jq New Indo - M,B0CQ25BQH7,Active
129-N.b.f Fashion,IM037616Mens Ranveer Koti - M,Mens Ranveer Koti - M,Amazon,Mens Ranveer Koti - M,B09Y8THMZ2,Active
129-N.b.f Fashion,IM137553Mens A- Blue Seq Indo - L,Mens A- Blue Seq Indo - L,Amazon,Mens A- Blue Seq Indo - L,B0CXPJV85Y,Active
129-N.b.f Fashion,IM035190Embro Blue Kurta Mens - M,Embro Blue Kurta Mens - M,Amazon,Embro Blue Kurta Mens - M,B0BZYZV234,Active
129-N.b.f Fashion,IM035280Mens (A) RK Dark Blue Indo-S,Mens (A) RK Dark Blue Indo-S,Amazon,Mens (A) RK Dark Blue Indo-S,B0CR7JKQ9V,Active
129-N.b.f Fashion,IM036104Mens Green Lakhanvi Kurta Set - XL,Mens Green Lakhanvi Kurta Set - XL,Amazon,Mens Green Lakhanvi Kurta Set - XL,B0BWRXY7G1,Active
129-N.b.f Fashion,IM036640Mens RK SKY New Side Indo - L,Mens RK SKY New Side Indo - L,Amazon,Mens RK SKY New Side Indo - L,B0CPYH99F5,Active
129-N.b.f Fashion,IM284203Mens Blue Indo-XL_new,Mens Blue Indo-XL_new,Amazon,Mens Blue Indo-XL_new,B0FM48DJ4N,Active
129-N.b.f Fashion,IM035715N Mens Blue Silver Indo - M,N Mens Blue Silver Indo - M,Amazon,N Mens Blue Silver Indo - M,B0B84W4GL2,Active
129-N.b.f Fashion,IM037268N Mens Light-pink Embro Kurta-L,N Mens Light-pink Embro Kurta-L,Amazon,N Mens Light-pink Embro Kurta-L,B0CD2M5WBB,Active
129-N.b.f Fashion,IM037940Red K P W- XL,Red K P W- XL,Amazon,Red K P W- XL,B08KYFPDPQ,Active
129-N.b.f Fashion,IM314577Girls Blue Multi Colour Choli 9-10 Y,Girls Blue Multi Colour Choli 9-10 Y,Amazon,Girls Blue Multi Colour Choli 9-10 Y,B0G5FGKXSF,Active
129-N.b.f Fashion,IM037297Mens Dayable Purple Indo Set- L,Mens Dayable Purple Indo Set- L,Amazon,Mens Dayable Purple Indo Set- L,B0CR957B7V,Active
129-N.b.f Fashion,IM314608Girls SKY Printed Frock 6-12 M,Girls SKY Printed Frock 6-12 M,Amazon,Girls SKY Printed Frock 6-12 M,B0G5FL96R3,Active
129-N.b.f Fashion,IM037620Mens Ranveer Red Indo - L,Mens Ranveer Red Indo - L,Amazon,Mens Ranveer Red Indo - L,B094X1SGBF,Active
129-N.b.f Fashion,IM284189Baby Girls Rani Pink Frock 5-6 Y,Baby Girls Rani Pink Frock 5-6 Y,Amazon,Baby Girls Rani Pink Frock 5-6 Y,B0FN48VGPN,Active
129-N.b.f Fashion,IM314596Girls Green Top Bottom 2-3 Y,Girls Green Top Bottom 2-3 Y,Amazon,Girls Green Top Bottom 2-3 Y,B0FTMJX549,Active
129-N.b.f Fashion,IM036642Mens RK SKY New Side Indo - XXL,Mens RK SKY New Side Indo - XXL,Amazon,Mens RK SKY New Side Indo - XXL,B0CPYH4DHM,Active
129-N.b.f Fashion,IM337646Mens Rama Indo Set - M,Mens Rama Indo Set - M,Amazon,Mens Rama Indo Set - M,B0GPCV8ZMS,Active
129-N.b.f Fashion,IM035281Mens (A) RK Dark Blue Indo-XL,Mens (A) RK Dark Blue Indo-XL,Amazon,Mens (A) RK Dark Blue Indo-XL,B0CR7KB24G,Active
129-N.b.f Fashion,IM035313Mens Blue Indo West - XXL,Men's Blue Indo West - XXL,Amazon,Men's Blue Indo West - XXL,B097JV3FS3,Active
129-N.b.f Fashion,IM271355Mens Light Yellow  Seq Kurta Set - M,Mens Light Yellow  Seq Kurta Set - M,Amazon,Mens Light Yellow  Seq Kurta Set - M,B0F9XCDKC9,Active
129-N.b.f Fashion,IM037338Purple MIrror Work Cotton Kurta-M,Purple MIrror Work Cotton Kurta-M,Amazon,Purple MIrror Work Cotton Kurta-M,B0CBS5GD2V,Active
129-N.b.f Fashion,IM037643Mens Red Embro Kurta Set  - M,Mens Red Embro Kurta Set  - M,Amazon,Mens Red Embro Kurta Set - M,B0B8658V4M,Active
129-N.b.f Fashion,IM036411Mens Maroon MKPNJ- M,Mens Maroon MKPNJ- M,Amazon,Mens Maroon MKPNJ- M,B08KNDKYW5,Active
129-N.b.f Fashion,IM035055Mens Black Mirror Work Kurta -M,Mens Black Mirror Work Kurta -M,Amazon,Mens Black Mirror Work Kurta -M,B0CBFQFVD3,Active
129-N.b.f Fashion,IM037659Mens Red indo Sherwani-L,Mens Red indo Sherwani-L,Amazon,Mens Red indo Sherwani-L,B0CC8Q5MY9,Active
129-N.b.f Fashion,IM035949Mens New Cream Indo Set - XL,Mens New Cream Indo Set - XL,Amazon,Mens New Cream Indo Set - XL,B0CR1K6XRV,Active
129-N.b.f Fashion,IM211639Mens Mahendi Keri Indo - XXL,Mens Mahendi Keri Indo - XXL,Amazon,Mens Mahendi Keri Indo - XXL,B0DR6RK7ZZ,Active
129-N.b.f Fashion,IM035120Mens_Shopsy B.B Indo-M,Mens_Shopsy B.B Indo-M,Amazon,Mens_Shopsy B.B Indo-M,B0C8Z817R8,Active
129-N.b.f Fashion,IM235733Mens Silver Multi Colour Indo - XXL,Mens Silver Multi Colour Indo - XXL,Amazon,Mens Silver Multi Colour Indo - XXL,B097N4KTRD,Active
129-N.b.f Fashion,IM186012Mens Maroon Satin Pattern Indo - L,Mens Maroon Satin Pattern Indo - L,Amazon,Mens Maroon Satin Pattern Indo - L,B0DCZSQ4PD,Active
129-N.b.f Fashion,IM037186Mens Pink Indo-M,Mens Pink Indo-M,Amazon,Mens Pink Indo-M,B0CBVL16Z1,Active
129-N.b.f Fashion,IM037507Mens  Red Ranveer Indo-S,Mens  Red Ranveer Indo-S,Amazon,Mens  Red Ranveer Indo-S,B09CDTFCPH,Active
129-N.b.f Fashion,IM037763Mens RK Dark Red Indo - M,Mens RK Dark Red Indo - M,Amazon,Mens RK Dark Red Indo - M,B0C9HBL1J4,Active
129-N.b.f Fashion,IM284228X-Mens Black Long Koti Sherwani-XXL_new,X-Mens Black Long Koti Sherwani-XXL_new,Amazon,X-Mens Black Long Koti Sherwani-XXL_new,B0FM7SFDF9,Active
129-N.b.f Fashion,IM036500Men Multicolor Spotted Kurta Set-M,Men Multicolor Spotted Kurta Set-M,Amazon,Men Multicolor Spotted Kurta Set-M,B0B6RQDM9Z,Active
129-N.b.f Fashion,IM037353Mens Ringni Dayable Indo - XXL,Mens Ringni Dayable Indo - XXL,Amazon,Mens Ringni Dayable Indo - XXL,B0CR484SQL,Active
129-N.b.f Fashion,IM036847Men Cream New Jq Indo - XL,Men Cream New Jq Indo - XL,Amazon,Men Cream New Jq Indo - XL,B0CR1H4SFL,Active
129-N.b.f Fashion,IM284161A- Baby Girls Pink Frock 4-5 Y,A- Baby Girls Pink Frock 4-5 Y,Amazon,A- Baby Girls Pink Frock 4-5 Y,B0FN46T3LS,Active
129-N.b.f Fashion,IM284151Baby Girls Rani Pink Frock 2-3 Y,Baby Girls Rani Pink Frock 2-3 Y,Amazon,Baby Girls Rani Pink Frock 2-3 Y,B0FN46Z2P8,Active
129-N.b.f Fashion,IM037750Mens Red Silve Indo - S,Mens Red Silve Indo - S,Amazon,Mens Red Silve Indo - S,B0B84X88RF,Active
129-N.b.f Fashion,IM038320Mens Yellow Ranveer Indo-XL,Mens Yellow Ranveer Indo-XL,Amazon,Mens Yellow Ranveer Indo-XL,B09CDVVF96,Active
129-N.b.f Fashion,IM037896N Ranveer Red Indo - XL,N Ranveer Red Indo - XL,Amazon,N Ranveer Red Indo - XL,B0B87J7TK2,Active
129-N.b.f Fashion,IM284179Baby Girls Wine Frock 4-5 Y,Baby Girls Wine Frock 4-5 Y,Amazon,Baby Girls Wine Frock 4-5 Y,B0FN42W5J1,Active
129-N.b.f Fashion,IM186004Mens Maroon Indo Western Set - XL,Mens Maroon Indo Western Set - XL,Amazon,Mens Maroon Indo Western Set - XL,B0DCZN24TJ,Active
129-N.b.f Fashion,IM314500Girls Green Top Bottom 4-5 Y,Girls Green Top Bottom 4-5 Y,Amazon,Girls Green Top Bottom 4-5 Y,B0FTMK734G,Active
129-N.b.f Fashion,IM037609Mens R.Red Indo - XXL,Mens R.Red Indo - XXL,Amazon,Mens R.Red Indo - XXL,B09SYVHZQD,Active
129-N.b.f Fashion,IM035005Mens Black Dayable Indo Set - M,Mens Black Dayable Indo Set - M,Amazon,Mens Black Dayable Indo Set - M,B0CR95NM9J,Active
129-N.b.f Fashion,IM034979Men Black Gold Indo Set - XL,Men Black Gold Indo Set - XL,Amazon,Men Black Gold Indo Set - XL,B0CR9482QW,Active
129-N.b.f Fashion,IM211641Mens Mahendi Keri Indo - M,Mens Mahendi Keri Indo - M,Amazon,Mens Mahendi Keri Indo - M,B0DR6RTW5M,Active
129-N.b.f Fashion,IM322444A- Girls Black Choli 2-3 Y,A- Girls Black Choli 2-3 Y,Amazon,A- Girls Black Choli 2-3 Y,B0G5ZGXLWQ,Active
129-N.b.f Fashion,IM337634Mens Grey Koti Kurta Set - XXL,Mens Grey Koti Kurta Set - XXL,Amazon,Mens Grey Koti Kurta Set - XXL,B0GPDHST9B,Active
129-N.b.f Fashion,IM036380Maroon Lakhnavi Kurta Set-L,Maroon Lakhnavi Kurta Set-L,Amazon,Maroon Lakhnavi Kurta Set-L,B0B6J15K26,Active
129-N.b.f Fashion,IM271382X- Mens Green Lining  Boxer - S,X- Mens Green Lining  Boxer - S,Amazon,X- Mens Green Lining  Boxer - S,B0FBJWKXY8,Active
129-N.b.f Fashion,IM037580Mens Light-Red Ijequard indo-M,Mens Light-Red Ijequard indo-M,Amazon,Mens Light-Red Ijequard indo-M,B0CC8SDXN6,Active
129-N.b.f Fashion,IM186007Mens Mahendi Pattern Indo Set - XXL,Mens Mahendi Pattern Indo Set - XXL,Amazon,Mens Mahendi Pattern Indo Set - XXL,B0DCZV79LQ,Active
129-N.b.f Fashion,IM038401Ranveer Yellow Indo - S,Ranveer Yellow Indo - S,Amazon,Ranveer Yellow Indo - S,B0B87H5M2P,Active
129-N.b.f Fashion,IM037895N Ranveer Red Indo - L,N Ranveer Red Indo - L,Amazon,N Ranveer Red Indo - L,B0B87GKF4J,Active
129-N.b.f Fashion,IM271399X- Mens Beige Dark Purple Boxer - XL,X- Mens Beige Dark Purple Boxer - XL,Amazon,X- Mens Beige Dark Purple Boxer - XL,B0FBJTZVMQ,Active
129-N.b.f Fashion,IM035104Mens Mirrar Work Black Kurta - XL,Mens Mirrar Work Black Kurta - XL,Amazon,Mens Mirrar Work Black Kurta - XL,B0CBLSKYNC,Active
129-N.b.f Fashion,IM037764Mens RK Dark Red Indo - S,Mens RK Dark Red Indo - S,Amazon,Mens RK Dark Red Indo - S,B0C9H9BN75,Active
129-N.b.f Fashion,IM035300Mens Blue Embro Kurta - S,Mens Blue Embro Kurta - S,Amazon,Mens Blue Embro Kurta - S,B0B864VYFG,Active
129-N.b.f Fashion,IM035703N Mens BLue JQ Ranveer Indo-XXL,N Mens BLue JQ Ranveer Indo-XXL,Amazon,N Mens BLue JQ Ranveer Indo-XXL,B0BX3V48Q9,Active
129-N.b.f Fashion,IM186036A-Men Blue Satin Pattern Indo Set -S,A-Men Blue Satin Pattern Indo Set -S,Amazon,A-Men Blue Satin Pattern Indo Set -S,B0DD4DTYF9,Active
129-N.b.f Fashion,IM036246Mens Pista Embro Kurta -XXL,Mens Pista Embro Kurta -XXL,Amazon,Mens Pista Embro Kurta -XXL,B0BWTX6LNX,Active
129-N.b.f Fashion,IM284204Mens Blue Indo-S_new,Mens Blue Indo-S_new,Amazon,Mens Blue Indo-S_new,B0FM4F1B6G,Active
